ID,患者编号,个人信息,医师姓名,中医疾病,中药组成,就诊日期,诊次,临床表现,舌质,舌苔,脉象,诊次原文,医案原文
KS7601, ty20190515020734,陈某 ，男 ，42岁 ,王檀,,,,2,诉初服药3日出现明显的腹痛腹泻，咳嗽明显好转，咳痰量明显减少，腹部胀满纳呆不适等症消失，进食增多,舌质淡,苔薄白,脉稍弱,2015年11月19日二诊，诉初服药3日出现明显的腹痛腹泻，咳嗽明显好转，咳痰量明显减少，腹部胀满纳呆不适等症消失，进食增多。服后2剂时已无明显咳嗽及腹痛，大便通畅，日1次，质稍稀。查其舌质淡，苔薄白，脉稍弱。嘱其停药，清淡饮食数日以调养脾胃。,陈某，男，42岁，2015年11月14日初诊。诉咳嗽3个月，时轻时重，咳痰量少质黏不易咳出，偶有腹部胀满不适，纳呆，大便黏腻不爽。10月21日行胸部CT检查示：肺纹理增强。先后静点头孢派酮舒巴坦钠、莫西沙星、阿奇霉素，盐酸氨溴索等药物，咳嗽稍有好转，随即反复。今就诊于我处，已停药1周。诸症同前，查其舌质红，苔黄腻，脉弦数。此为慢性咳嗽，大肠湿热型。治当清热利湿，宣肺止咳。予木香槟榔丸加减：木香6g，槟榔10g，青皮10g，陈皮10g，麸炒枳实6g，黄柏12g，黄连9g，莪术10g，醋三棱10g，生大黄9g，牵牛子6g，香附10g，炒杏仁10g，蜜麻黄12g。共五剂，每日1剂，早晚分服，嘱其忌食生冷油腻，并告之患者服药期间会出现腹痛、腹泻等症状，属正常现象可继续服药。（注：因牵牛子加热后其泻下成分遭到破坏失去泻下作用[9]，故全方改用免煎颗粒剂型以保证药效，下同）。2015年11月19日复诊，诉初服药3日出现明显的腹痛腹泻，咳嗽明显好转，咳痰量明显减少，腹部胀满纳呆不适等症消失，进食增多。服后2剂时已无明显咳嗽及腹痛，大便通畅，日1次，质稍稀。查其舌质淡，苔薄白，脉稍弱。嘱其停药，清淡饮食数日以调养脾胃。按：王檀教授认为本患者湿热结聚于大肠，腑气不通，困遏脾胃，运化失司，故会出现腹部胀满不适，纳呆，大便黏腻不爽等症。湿郁日久化热，热邪夹湿上犯于肺，肺为湿热所伤，宣降失常故会出现咳嗽，又因湿热相合熏蒸肺津故痰少质黏不易咳出，咳嗽反复不愈。诸症皆因湿热结聚于肠，若湿热得去则上可缓肺金之熏蒸，中可解脾胃之困遏，下可复腑气之通畅。本方所用攻下派张从正《儒门事亲》中所载木香槟榔丸加减，其中含大黄、莪术、三棱、牵牛子等攻伐之品，故服用后会出现明显的腹痛腹泻，此为肠中湿热邪气随糟粕而下的正常现象，待湿热尽去后腹痛用泻症状逐渐缓解。因本药多含攻伐之品，故中病即止以免耗伤正气。患者二诊时咳嗽明显减轻，咳痰明显减少，腹部胀满纳呆等症状消失，舌象转为淡红舌、薄白苔，脉中弦数之象消失，表明湿热邪气尽去。患者进食较前增多为湿热邪气除后脾气健旺之象，虽大便稍稀，亦不足为虑，待药力尽去，脾气更旺之时自会好转。因此时患者脾胃尚虚，故嘱其清淡饮食数日，以免加重脾胃负担。
KS7602,ty20190510010467,黎某某 ，男 ，55岁 ,陈新宇,,"方用桂枝汤合二陈汤加减：黄芪35g,桂枝3g,白芍15g,生牡蛎25g,浙贝母15g,土茯苓15g,半枝莲15g,牡丹皮10g,七叶一枝花15g,桃仁5g,茯苓10g,灵芝15g,玄参15g,法半夏10g,胆星5g,麦冬15g,五味子5g,陈皮10g,白术15g,炮姜5g,甘草10g,大枣6枚,百合15g,莪术15g,熟地黄15g,细辛1g方用射干麻黄汤加减：炙麻黄5g,生石膏25g,法夏10g,白术15g,生地黄25g,知母10g,地榆10g,仙鹤草15g,荆芥10g,防风10g,百合10g,沙参15g,玄参10g,五味子10g,麦冬15g,甘草10g,大枣6枚予初诊方去浙贝、胆星，加土贝母15g，薏苡仁25g",1973年3月,初诊：2014年6月5日。;二诊：2014年8月15日。;三诊：2014年11月11日。;初诊方去浙贝、胆星，加土贝母15g，薏苡仁25g。;二诊时咳嗽发热为感受外邪而作，午后发热至半夜，及咳嗽黏痰血丝可知，患者外感后迁延未愈，至外邪入内，气阴两伤，故脾肺双补，扶正养阴，散表邪。,,,舌淡紫;苔白厚;舌紫暗;苔白厚腻;苔黄,脉弦;脉弦涩;经脉通畅,"黎某某，男，55岁。初诊：2014年6月5日。主诉：干咳半年。现病史：咳嗽痰少，偶有痰中血丝，气短乏力。舌淡紫，苔白厚，脉弦。CT示：右肺上叶软组织肿块，大小88mm×103mm×110mm，考虑右肺上叶中央型肺癌。当地医院诊断为右肺少量低分化鳞癌。中医诊断：肺积(气虚痰结证)。治法：温阳通络，扶正祛邪。方用桂枝汤合二陈汤加减：黄芪35g,桂枝3g,白芍15g,生牡蛎25g,浙贝母15g,土茯苓15g,半枝莲15g,牡丹皮10g,七叶一枝花15g,桃仁5g,茯苓10g,灵芝15g,玄参15g,法半夏10g,胆星5g,麦冬15g,五味子5g,陈皮10g,白术15g,炮姜5g,甘草10g,大枣6枚,百合15g,莪术15g,熟地黄15g,细辛1g。14剂，水煎温服。二诊：2014年8月15日。诉服上方后咳嗽减轻，但近期外感，畏寒汗出，多于午后14∶00许发热，体温升高至38℃上下，夜半24∶00许自解。初咳吐白色泡沫样痰，后痰中夹杂血丝血块，乏力纳少。舌紫暗，苔白厚腻，脉弦涩。诊断：外感风寒，肺胃气虚。方用射干麻黄汤加减：炙麻黄5g,生石膏25g,法夏10g,白术15g,生地黄25g,知母10g,地榆10g,仙鹤草15g,荆芥10g,防风10g,百合10g,沙参15g,玄参10g,五味子10g,麦冬15g,甘草10g,大枣6枚。14剂，水煎温服。三诊：2014年11月11日。诉咳嗽发热未做，颜面浮肿，乏力。舌淡紫，苔黄，脉弦涩。CT复查肺部肿块无明显变化。方证相应。予初诊方去浙贝、胆星，加土贝母15g，薏苡仁25g。患者药后自觉咳嗽未做，浮肿减轻，继续巩固治疗。按语：陈教授认为，如内经所言“阳化气，阴成形”，恶性肿瘤的根本病机在于体内阳气不足，气血不通，阴气凝结而成Y瘕。因此，在治疗肺癌所致咳嗽时，不仅要补益肺气，随证止咳，更要注意护卫阳气，振奋脾肾之阳。唯有阳气健旺，经脉通畅，癌症治疗才有效果。因此，患者首诊时采用桂枝汤加减温阳通经，二陈汤健脾化痰，清上焦痰饮，荡涤寒凝，佐以土茯苓、半枝莲、七叶一枝花等抗肿瘤之品扶正祛邪。二诊时咳嗽发热为感受外邪而作，午后发热至半夜，及咳嗽黏痰血丝可知，患者外感后迁延未愈，至外邪入内，气阴两伤，故脾肺双补，扶正养阴，散表邪。治疗时以石膏麻黄发表散邪，又加白术半夏等健运脾阳之品补气固表，同时以大量养阴之品，填精养52湖南中医药大学学报2016年第36卷肺，收效满意。三诊时咳嗽咳痰症状已不显，略水肿。效不更方，仍用初诊方加减。患者在半年之内并未采用放疗或化疗。","黎某某，男，55岁。初诊：2014年6月5日。主诉：干咳半年。现病史：咳嗽痰少，偶有痰中血丝，气短乏力。舌淡紫，苔白厚，脉弦。CT示：右肺上叶软组织肿块，大小88mm×103mm×110mm，考虑右肺上叶中央型肺癌。当地医院诊断为右肺少量低分化鳞癌。中医诊断：肺积(气虚痰结证)。治法：温阳通络，扶正祛邪。方用桂枝汤合二陈汤加减：黄芪35g,桂枝3g,白芍15g,生牡蛎25g,浙贝母15g,土茯苓15g,半枝莲15g,牡丹皮10g,七叶一枝花15g,桃仁5g,茯苓10g,灵芝15g,玄参15g,法半夏10g,胆星5g,麦冬15g,五味子5g,陈皮10g,白术15g,炮姜5g,甘草10g,大枣6枚,百合15g,莪术15g,熟地黄15g,细辛1g。14剂，水煎温服。二诊：2014年8月15日。诉服上方后咳嗽减轻，但近期外感，畏寒汗出，多于午后14∶00许发热，体温升高至38℃上下，夜半24∶00许自解。初咳吐白色泡沫样痰，后痰中夹杂血丝血块，乏力纳少。舌紫暗，苔白厚腻，脉弦涩。诊断：外感风寒，肺胃气虚。方用射干麻黄汤加减：炙麻黄5g,生石膏25g,法夏10g,白术15g,生地黄25g,知母10g,地榆10g,仙鹤草15g,荆芥10g,防风10g,百合10g,沙参15g,玄参10g,五味子10g,麦冬15g,甘草10g,大枣6枚。14剂，水煎温服。三诊：2014年11月11日。诉咳嗽发热未做，颜面浮肿，乏力。舌淡紫，苔黄，脉弦涩。CT复查肺部肿块无明显变化。方证相应。予初诊方去浙贝、胆星，加土贝母15g，薏苡仁25g。患者药后自觉咳嗽未做，浮肿减轻，继续巩固治疗。按语：陈教授认为，如内经所言“阳化气，阴成形”，恶性肿瘤的根本病机在于体内阳气不足，气血不通，阴气凝结而成Y瘕。因此，在治疗肺癌所致咳嗽时，不仅要补益肺气，随证止咳，更要注意护卫阳气，振奋脾肾之阳。唯有阳气健旺，经脉通畅，癌症治疗才有效果。因此，患者首诊时采用桂枝汤加减温阳通经，二陈汤健脾化痰，清上焦痰饮，荡涤寒凝，佐以土茯苓、半枝莲、七叶一枝花等抗肿瘤之品扶正祛邪。二诊时咳嗽发热为感受外邪而作，午后发热至半夜，及咳嗽黏痰血丝可知，患者外感后迁延未愈，至外邪入内，气阴两伤，故脾肺双补，扶正养阴，散表邪。治疗时以石膏麻黄发表散邪，又加白术半夏等健运脾阳之品补气固表，同时以大量养阴之品，填精养52湖南中医药大学学报2016年第36卷肺，收效满意。三诊时咳嗽咳痰症状已不显，略水肿。效不更方，仍用初诊方加减。患者在半年之内并未采用放疗或化疗。"
KS7603,ty20190515020734,陈某 ，男 ，42岁 ,王檀,,药物，咳嗽稍有好转，随即反复,,1,我处，已停药1周。诸症同前，查其舌质红，苔黄腻，脉弦数。此为慢性咳嗽，大肠湿热型。治当清热利湿，宣肺止咳。予木香槟榔丸加减：木香6g，槟榔10g，青皮10g，陈皮10g，麸炒枳实6g，黄柏12g，黄连9g，莪术10g，醋三棱10g，生大黄9g，牵牛子6g，香附10g，炒杏仁10g，蜜麻黄12g。共五剂，每日1剂，早晚分服，嘱其忌食生冷油腻，并告之患者服药期间会出现腹痛、腹泻等症状，属正常现象可继续服药。（注：因牵牛子加热后其泻下成分遭到破坏失去泻下作用[9]，故全方改用免煎颗粒剂型以保证药效，下同）,舌质红,苔黄腻,脉弦数,陈某，男，42岁，2015年11月14日初诊。诉咳嗽3个月，时轻时重，咳痰量少质黏不易咳出，偶有腹部胀满不适，纳呆，大便黏腻不爽。10月21日行胸部CT检查示：肺纹理增强。先后静点头孢派酮舒巴坦钠、莫西沙星、阿奇霉素，盐酸氨溴索等药物，咳嗽稍有好转，随即反复。今就诊于我处，已停药1周。诸症同前，查其舌质红，苔黄腻，脉弦数。此为慢性咳嗽，大肠湿热型。治当清热利湿，宣肺止咳。予木香槟榔丸加减：木香6g，槟榔10g，青皮10g，陈皮10g，麸炒枳实6g，黄柏12g，黄连9g，莪术10g，醋三棱10g，生大黄9g，牵牛子6g，香附10g，炒杏仁10g，蜜麻黄12g。共五剂，每日1剂，早晚分服，嘱其忌食生冷油腻，并告之患者服药期间会出现腹痛、腹泻等症状，属正常现象可继续服药。（注：因牵牛子加热后其泻下成分遭到破坏失去泻下作用[9]，故全方改用免煎颗粒剂型以保证药效，下同）。,陈某，男，42岁，2015年11月14日初诊。诉咳嗽3个月，时轻时重，咳痰量少质黏不易咳出，偶有腹部胀满不适，纳呆，大便黏腻不爽。10月21日行胸部CT检查示：肺纹理增强。先后静点头孢派酮舒巴坦钠、莫西沙星、阿奇霉素，盐酸氨溴索等药物，咳嗽稍有好转，随即反复。今就诊于我处，已停药1周。诸症同前，查其舌质红，苔黄腻，脉弦数。此为慢性咳嗽，大肠湿热型。治当清热利湿，宣肺止咳。予木香槟榔丸加减：木香6g，槟榔10g，青皮10g，陈皮10g，麸炒枳实6g，黄柏12g，黄连9g，莪术10g，醋三棱10g，生大黄9g，牵牛子6g，香附10g，炒杏仁10g，蜜麻黄12g。共五剂，每日1剂，早晚分服，嘱其忌食生冷油腻，并告之患者服药期间会出现腹痛、腹泻等症状，属正常现象可继续服药。（注：因牵牛子加热后其泻下成分遭到破坏失去泻下作用[9]，故全方改用免煎颗粒剂型以保证药效，下同）。2015年11月19日复诊，诉初服药3日出现明显的腹痛腹泻，咳嗽明显好转，咳痰量明显减少，腹部胀满纳呆不适等症消失，进食增多。服后2剂时已无明显咳嗽及腹痛，大便通畅，日1次，质稍稀。查其舌质淡，苔薄白，脉稍弱。嘱其停药，清淡饮食数日以调养脾胃。按：王檀教授认为本患者湿热结聚于大肠，腑气不通，困遏脾胃，运化失司，故会出现腹部胀满不适，纳呆，大便黏腻不爽等症。湿郁日久化热，热邪夹湿上犯于肺，肺为湿热所伤，宣降失常故会出现咳嗽，又因湿热相合熏蒸肺津故痰少质黏不易咳出，咳嗽反复不愈。诸症皆因湿热结聚于肠，若湿热得去则上可缓肺金之熏蒸，中可解脾胃之困遏，下可复腑气之通畅。本方所用攻下派张从正《儒门事亲》中所载木香槟榔丸加减，其中含大黄、莪术、三棱、牵牛子等攻伐之品，故服用后会出现明显的腹痛腹泻，此为肠中湿热邪气随糟粕而下的正常现象，待湿热尽去后腹痛用泻症状逐渐缓解。因本药多含攻伐之品，故中病即止以免耗伤正气。患者二诊时咳嗽明显减轻，咳痰明显减少，腹部胀满纳呆等症状消失，舌象转为淡红舌、薄白苔，脉中弦数之象消失，表明湿热邪气尽去。患者进食较前增多为湿热邪气除后脾气健旺之象，虽大便稍稀，亦不足为虑，待药力尽去，脾气更旺之时自会好转。因此时患者脾胃尚虚，故嘱其清淡饮食数日，以免加重脾胃负担。
KS7604,81603,，男 ，10岁 ,徐荣谦,小儿咳嗽（肾虚水气上浮,生地黄15g，熟地黄15g，山药4g，山茱萸4g，牡丹皮4g，茯苓9g，泽泻9g，炮附子3g，桂枝1g，焦栀子6g，淡豆豉6g，苏叶6g，苏子6g，苏梗6g，干姜1g，五味子2g，芦根30g，鲜竹沥（兑）10mL,,1,咳嗽，呼吸微重促。纳差，眠差，二便正常。查：面色不泽，双目不灵活，口唇黑红，毛发干枯无泽，身上皮肤黑黄，双目下眼睑泛黑色。咽部微红。听诊：双肺湿音。舌质淡嫩，舌尖微红，苔白水滑，根部厚腻。脉沉细软,舌尖微红,苔白水滑,脉沉细软,患者甲，男，10岁。初诊：2018年6月9日。患儿自幼常发热，气管炎经常发作，平时多使用抗生素、输液、雾化等西医治疗，尚且不能断根。于昨日夜间发热，体温未测，家长给其口服退热药一次，烧退变喘，来我中医科就诊。刻下症见：咳嗽，呼吸微重促。纳差，眠差，二便正常。查：面色不泽，双目不灵活，口唇黑红，毛发干枯无泽，身上皮肤黑黄，双目下眼睑泛黑色。咽部微红。听诊：双肺湿音。舌质淡嫩，舌尖微红，苔白水滑，根部厚腻。脉沉细软。中医诊断：小儿咳嗽（肾虚水气上浮，肺气不宣）。西医诊断：小儿支气管炎。治法：补肾制水，宣肺豁痰。方药：金匮肾气丸加减。处方：生地黄15g，熟地黄15g，山药4g，山茱萸4g，牡丹皮4g，茯苓9g，泽泻9g，炮附子3g，桂枝1g，焦栀子6g，淡豆豉6g，苏叶6g，苏子6g，苏梗6g，干姜1g，五味子2g，芦根30g，鲜竹沥（兑）10mL。3剂，水煎服，每日一剂，分3次服。,患者甲，男，10岁。初诊：2018年6月9日。患儿自幼常发热，气管炎经常发作，平时多使用抗生素、输液、雾化等西医治疗，尚且不能断根。于昨日夜间发热，体温未测，家长给其口服退热药一次，烧退变喘，来我中医科就诊。刻下症见：咳嗽，呼吸微重促。纳差，眠差，二便正常。查：面色不泽，双目不灵活，口唇黑红，毛发干枯无泽，身上皮肤黑黄，双目下眼睑泛黑色。咽部微红。听诊：双肺湿音。舌质淡嫩，舌尖微红，苔白水滑，根部厚腻。脉沉细软。中医诊断：小儿咳嗽（肾虚水气上浮，肺气不宣）。西医诊断：小儿支气管炎。治法：补肾制水，宣肺豁痰。方药：金匮肾气丸加减。处方：生地黄15g，熟地黄15g，山药4g，山茱萸4g，牡丹皮4g，茯苓9g，泽泻9g，炮附子3g，桂枝1g，焦栀子6g，淡豆豉6g，苏叶6g，苏子6g，苏梗6g，干姜1g，五味子2g，芦根30g，鲜竹沥（兑）10mL。3剂，水煎服，每日一剂，分3次服。二诊：2018年6月11日。家长描述咳嗽好转，呼吸已平稳，刻下症见：咳嗽明显好转，呼吸微重促好转，纳少可，睡眠好转，能够平稳睡眠。查：面色略有红润，双目灵活，口唇黑红，毛发干枯无泽，身上皮肤黑黄，双目下眼睑泛黑色。咽扁（-），听诊双肺（-），舌质淡嫩，舌尖微红，苔白水滑，根部厚腻已化，脉细软。精神稍振奋，尚且不足。诊断：小儿咳嗽（肾虚体质，精气不足）。方药：金匮肾气丸加减。处方：生地黄15g，熟地黄15g，山药4g，山茱萸4g，牡丹皮4g，茯苓9g，泽泻9g，炮附子6g，芦根30g，桂枝1g，焦栀子6g，淡豆豉6g，干姜1g，五味子2g，柴胡1.5g，鲜竹沥10mL。7剂，水煎服，每日一剂，分3次服。三诊：2018年6月18日。家长描述：咳嗽基本痊愈。患儿不喜中药，未予药物，嘱不适随诊。观察随访数月，患儿咳嗽未再反复。家长述治疗后患儿学习成绩明显上升，精力较从前有所上升，自信心、精神状态都相应的有所提升。按：该患儿经常发作支气管炎，影响正常的生长发育；长期运用西药激素、抗生素产生了耐药性，支气管炎没有得到根本性的治疗。家长无奈转看中医，患儿虽然是气管炎急性发作，但是从其面容、舌象、脉象，基本符合徐荣谦教授所提出的肾虚体质。肾主水，肾脏统制一身之水气。虽属于气管炎急性发作，但中医辨证以肾虚为主。故用金匮肾气丸原方加减补肾宣肺化痰，取得了良好的疗效。家长述患儿经治疗后咳嗽痊愈，学习成绩有所提升，精力、自信心、精神状态都有所好转。
KS7605,81603,，男 ，10岁 ,徐荣谦,,生地黄15g，熟地黄15g，山药4g，山茱萸4g，牡丹皮4g，茯苓9g，泽泻9g，炮附子6g，芦根30g，桂枝1g，焦栀子6g，淡豆豉6g，干姜1g，五味子2g，柴胡1.5g，鲜竹沥10mL,2018年6月11日,2,,舌尖微红,苔白水滑,脉细软,二诊：2018年6月11日。家长描述咳嗽好转，呼吸已平稳，刻下症见：咳嗽明显好转，呼吸微重促好转，纳少可，睡眠好转，能够平稳睡眠。查：面色略有红润，双目灵活，口唇黑红，毛发干枯无泽，身上皮肤黑黄，双目下眼睑泛黑色。咽扁（-），听诊双肺（-），舌质淡嫩，舌尖微红，苔白水滑，根部厚腻已化，脉细软。精神稍振奋，尚且不足。诊断：小儿咳嗽（肾虚体质，精气不足）。方药：金匮肾气丸加减。处方：生地黄15g，熟地黄15g，山药4g，山茱萸4g，牡丹皮4g，茯苓9g，泽泻9g，炮附子6g，芦根30g，桂枝1g，焦栀子6g，淡豆豉6g，干姜1g，五味子2g，柴胡1.5g，鲜竹沥10mL。7剂，水煎服，每日一剂，分3次服。,患者甲，男，10岁。初诊：2018年6月9日。患儿自幼常发热，气管炎经常发作，平时多使用抗生素、输液、雾化等西医治疗，尚且不能断根。于昨日夜间发热，体温未测，家长给其口服退热药一次，烧退变喘，来我中医科就诊。刻下症见：咳嗽，呼吸微重促。纳差，眠差，二便正常。查：面色不泽，双目不灵活，口唇黑红，毛发干枯无泽，身上皮肤黑黄，双目下眼睑泛黑色。咽部微红。听诊：双肺湿音。舌质淡嫩，舌尖微红，苔白水滑，根部厚腻。脉沉细软。中医诊断：小儿咳嗽（肾虚水气上浮，肺气不宣）。西医诊断：小儿支气管炎。治法：补肾制水，宣肺豁痰。方药：金匮肾气丸加减。处方：生地黄15g，熟地黄15g，山药4g，山茱萸4g，牡丹皮4g，茯苓9g，泽泻9g，炮附子3g，桂枝1g，焦栀子6g，淡豆豉6g，苏叶6g，苏子6g，苏梗6g，干姜1g，五味子2g，芦根30g，鲜竹沥（兑）10mL。3剂，水煎服，每日一剂，分3次服。二诊：2018年6月11日。家长描述咳嗽好转，呼吸已平稳，刻下症见：咳嗽明显好转，呼吸微重促好转，纳少可，睡眠好转，能够平稳睡眠。查：面色略有红润，双目灵活，口唇黑红，毛发干枯无泽，身上皮肤黑黄，双目下眼睑泛黑色。咽扁（-），听诊双肺（-），舌质淡嫩，舌尖微红，苔白水滑，根部厚腻已化，脉细软。精神稍振奋，尚且不足。诊断：小儿咳嗽（肾虚体质，精气不足）。方药：金匮肾气丸加减。处方：生地黄15g，熟地黄15g，山药4g，山茱萸4g，牡丹皮4g，茯苓9g，泽泻9g，炮附子6g，芦根30g，桂枝1g，焦栀子6g，淡豆豉6g，干姜1g，五味子2g，柴胡1.5g，鲜竹沥10mL。7剂，水煎服，每日一剂，分3次服。三诊：2018年6月18日。家长描述：咳嗽基本痊愈。患儿不喜中药，未予药物，嘱不适随诊。观察随访数月，患儿咳嗽未再反复。家长述治疗后患儿学习成绩明显上升，精力较从前有所上升，自信心、精神状态都相应的有所提升。按：该患儿经常发作支气管炎，影响正常的生长发育；长期运用西药激素、抗生素产生了耐药性，支气管炎没有得到根本性的治疗。家长无奈转看中医，患儿虽然是气管炎急性发作，但是从其面容、舌象、脉象，基本符合徐荣谦教授所提出的肾虚体质。肾主水，肾脏统制一身之水气。虽属于气管炎急性发作，但中医辨证以肾虚为主。故用金匮肾气丸原方加减补肾宣肺化痰，取得了良好的疗效。家长述患儿经治疗后咳嗽痊愈，学习成绩有所提升，精力、自信心、精神状态都有所好转。
