ID,中医疾病,中医证候：,医案原文：医案来源,,医师姓名
SM7508,郁证,"肝气郁结,",何某，男，35岁。情志抑郁年余，善太息，失眠多梦，口吐痰涎，巅顶作痛，纳食少，常因情志不或着凉后益甚，久以硫肝、健牌、祛痰诸法治疗，皆不见转机。今见气色不华，手欠温，舌质淡苔白滑，脉沉弦细。证属肝经阳气不足，失于温煦．升发无力致疏泄失常之郁证，非实证也。再步前医之疏肝开郁法亦无效，故宜治本。用温肝法，访吴茱萸汤之理化裁。吴茱萸、人参、桂枝各10克，麦芽15克，生姜5片，大枣10枚。每日服1剂，并忌食生冷之品。药进4剂后，果感精神大振，抑郁之感大消。继守上方3剂后，喜告病愈。,温肝法亦可治郁证,无
SM7108,无,无,侯某某，女，84岁，于2014年11月20日初诊。患者失眠40余年，近2年甚至彻夜难眠，偶可入睡亦乱梦纷扰。情绪暴躁，疑心较重，时谩骂家人，尊之任之则舒。面色无华，常有头晕头痛，胸闷短气，善忘。寸、尺脉弦细而涩，关脉独滑，舌略红，苔薄黄中部略厚，大便周余未行。证属阳明腑气不降，秽浊上逆，上扰神明，灼伤血络，日久成瘀。治疗以血府逐瘀汤加减:当归12g，生地12g，红花6g，桃仁12g，枳壳15g，赤芍12g，柴胡9g，炙甘草6g，桔梗12g，川芎6g，川牛膝9g，瓜蒌15g，炒火麻仁15g，大腹皮12g。7剂，水煎服。11月27日二诊:自述服药两剂后即由原来的彻夜不眠好转至一宿能睡2～3h，面色亦见少许红润，并且解大手也通畅，舌苔白腻。加荷叶6g，升麻6g，水红花子12g，续服7剂。12月4日三诊:精神状态较之前更佳，睡眠改善更明显，舌苔之腻已除。其女诉服药当晚即可闻及其母之鼾声，为以往所不能有，白日谩骂声亦减少。嘱原方续服7剂。随访颇佳。按语:该患者年老体衰，失眠日久，神不安舍，邪陷阳明，腑气不降。《素问・六微旨大论》云:“出入废则神机化灭，升降息则气立孤危”。清・唐笠山《吴医汇讲》亦云:“升降出入四字，为一生之a，百病之纲领”。《读医随笔》亦曰:“人之意，神识能用者，皆曰升降出入之通利也，有所闭塞，则不能用也”。故升降出入是正常神志活动的重要保证，头为神明出入之枢，与气机运行密切相关。彻夜不眠、乱梦纷扰均是睡眠质量欠佳的表现，此因气机不畅，腑气不通，则排出无时；浊气不出，精气不藏，不能养于脑，神识异常；关脉滑为阳明腑气不降，邪气滞留中焦的表现。同时善忘也与胃肠有关，如《灵枢・大惑论》云:“人之善忘者，何气使然?岐伯曰:上气不足，下气有余，肠胃实而心肺虚，虚则营卫留于下，久之不以时上，故善忘也”。又《素问・示腑气不畅，浊物不出，故以枳壳、桔梗条畅腑气出入之气机。伍以当归、生地、桃仁养血润肠且以红花、赤芍化瘀以通腑，因其年老体衰，布津失常，又伍以瓜蒌、火麻仁来增水行舟，同时可防红花、赤芍攻伐太过。在王氏所述血府逐瘀汤症中，“夜里梦多”、“不眠”、“夜不安”三症与失眠直接相关，另有“胸任重物”、“胸不任物”、“瞀闷”、“急躁”、“心跳心慌”等与失眠的发生间接相关，这些症状皆可求之于腑气不通。不通者应使之通，《医学传真》云:“通之之法，各有不同。调气以和血，调血以和气，通也；上逆者使之下行，中结者使之旁达，亦通也；虚者助之使通，寒者温之使通，无非通之之法也，若必以下泻为通，则妄也。”取枳壳、桔梗调升降，非妄用泻下之法，当归、火麻仁养血且润肠，不伤脾胃，同时又伍以升麻、荷叶升清降浊，使气得上下，五脏安定，血脉和利。腑通浊降则气机调，天气下降，地气升腾，天地气交，阴阳协调，藏写有度，精神乃居。精汁之清藏于脑，不被浊气侵犯，则神魂可安，自可承阴顺阳，日落而眠；水谷之浊聚于腑，泻有定时，则气机周流，上可养神助眠，下可通条行气。《灵枢・天年》言:“六腑化谷，津液布扬，各如其常，故以长久”。,无,无
SM7110,郁证,心神失养,"张某,女,30岁。初诊日期:2006年1月26日。因情志抑郁、失眠2年,加重月余而就诊。患者2年前患皮肤湿疹,久治未愈,导致精神紧张、忧愁、失眠,当地医生诊为抑郁症,口服抗抑郁西药(具体用药不详)3个月好转,停药后6个月而复发,继服抗抑郁药6个月未明显缓解,于2005年12月症情反复、症状加重,失眠严重。慕名到上海,手捧5裘沛然医论集6一书到裘老门诊处求诊。刻诊:心悸、胸闷,精神易紧张,情绪低落,夜寐不安,仅能睡眠2~3个小时。经当地中医治疗后能安睡4~5个小时,并伴有神疲乏力,眩晕头胀,纳食不馨,月经衍期,40~50天经行一次,量少,大便正常。舌边尖红,苔薄,脉细少力。此肝气郁结,郁而化热,心失所养。治宜益气养阴、疏肝解郁、清心安神。处方:炙甘草18g,桂枝18g,麦门冬18g,西红花(后下)1g,黄连9g,生地黄30g,生龙骨30g,生龙齿(先煎)30g,生牡蛎(先煎)30g,常山9g,茯苓12g,茯神12g,郁金15g,党参18g,生姜6g,大枣7枚。水煎服,每日1剂,服7剂。嘱心情放松,生活有规律,每天散步活动,避免劳累。二诊:2月9日服上药7剂,睡眠质量明显好转,每晚可入眠6h左右,精神逐渐振作,信心大增;仍有心悸、胸闷,容易紧张,偶有恐惧感,舌边尖红,苔薄,脉细。上方去郁金,加煅磁石(先煎)30g,川芎15g,桂枝改为20g。水煎服,每日1剂,服14剂。三诊:2月23日服14剂后夜寐转佳,仍有精神紧张感,神疲乏力,舌黯红,苔薄,脉细。上方续进14剂。四诊:3月4日夜寐时好时差,仍有心悸和恐惧感,倦怠乏力,纳食欠馨,经期已过40天,未见经汛,舌暗红,苔薄微腻,脉细少力。处方:野山人参1g,左牡蛎(先煎)30g,生龙骨30g,生龙齿(先煎)30g,藿香15g,紫苏梗15g,阿胶(烊冲)9g,炙甘草20g,川桂枝24g,生地黄30g,常山10g,麦门冬18g,五味子9g,广郁金15g,益母草30g,丹参20g,淡干姜15g,生姜4.5g,大枣7枚。再服14剂。五诊:3月19日神疲乏力明显改善,行走明显感觉轻松,恐惧、紧张心理进一步好转,心悸亦较前大为改善;近有干咳,寐中有恶梦,偶有胸闷不适,纳食一般。药后7天经汛至。舌黯红,苔薄,脉细较前有力。上方去龙骨、龙齿、五味子、藿香、紫苏梗,加云茯苓15g,全当归18g,川芎15g,酸枣仁20g,细辛9g。服7剂。经2个月中药治疗,抑郁症已基本治愈。因月经失调,经期衍迟,婚后3年未孕。故治宜调经补肾、益气养血、疏肝解郁为主。",裘沛然临证验案举要,裘沛然
SM7114,白淫,无,刘××，女，29岁，初诊于1978年4月23日。多梦不寐，常有梦交，醒后多见大量类白带之物下出。长期以来，头晕且痛，口苦咽干，急躁不安，小便黄赤，大便秘结，舌红、苔黄，脉弦稍数。使用上述郁火证者所用之方2次，急躁、头晕、头痛明显减轻，大便得畅。数次之后梦交白淫、急躁、头晕头痛等症消失，余症明显减轻。守原方计针10余次，梦交白淫一直未再发生，余症全部消失。数月之后追访，白淫症从未再发。 针灸验方 带脉 中极 次s 郁火所致者，加太冲、少府，诸穴A，持续行针数分钟出针；大便秘结者，再加大肠俞A、上巨虚A、支沟A，持续行针数分钟出针；郁火伤阴者再加三阴交B、太溪B，持续行针数分钟出针。肾虚所致者加肾俞、复溜，诸穴B，持续行针数分钟出针。,针灸辨证论治验方,无
SM7306,奔豚,肝郁气结，心阳不振，痰湿不化,卫××，男，50岁。冠心病，频发性室性期前收缩两年。前医以炙甘草汤、生脉散、养心汤、补心丹及血府逐瘀汤等治之不效。察其证见胃脘部悸动，阵阵发作，逆气上冲，冲至胸则胸满气短，心悸惊恐，甚至晕厥，有几次在骑自行车时突然发作而摔倒在地，经抢救才清醒，并经常头晕失眠，胸满心烦，口苦咽干，舌苔薄白，脉弦滑。综合脉证，诊为肝郁气结，心阳不振，痰湿不化之证。为拟柴胡加龙骨牡蛎合苓桂术甘汤加减：柴胡6克，黄芩9克，白术9克，党参9克，半夏9克，生姜9克，茯苓15克，桂枝15克，龙骨15克，牡蛎15克，川军3克，大枣5枚。,《朱进忠医案》,朱进忠
SM7406,郁证,无,徐某，女，49岁。烦躁不宁，严重失眠，心悸气促，二手S，面胖色红，微有浮肿，舌红苔薄，脉弦。曾服西药疗效不著，拟单方图价，佐以开导。处方：百合、豆枯草各30克。五剂。二诊：药后睡寐可达5小时，面容红活，治已奏效，原方复加柏子仁、枸杞子各9克。再进五剂。三诊，夜晚己能安卧，心悸气促亦平，二手抽搐未作，但梦多、耳鸣、舌色红润，脉缓。拟平肝、宁神、补肾。处方：百合、夏枯草各30克，制首乌、淮牛膝、红枣各15克。五剂。问诊眠食正常，神志安宁，偶有耳鸣，舌润，脉缓原法增损再进，巩固疗效。处方：百合30克，夏枯草、酸枣仁各15克，广藿香3克，红枣9克。五剂。,治郁浅谈,无
SM7405,郁证,心脾两虚,陈某，女，26岁，2016年5月30日就诊。患者因1个月前1周岁儿子夭折遭受重大打击，伤心过度。刻诊:患者精神萎靡，面色不华，时而出现头晕、视物模糊、继而全身瘫软的情况，失眠健忘，四肢冷，偶有汗出，纳差，舌淡，脉微细。病机:七情过极，情志失调，肝郁抑脾，忧思伤脾，脾虚血亏，心失所养。证型:心脾两虚证。治法:理气健脾，养心安神。处方:八脉交会穴内关、公孙一组为主穴，配百会、足三里、阴陵泉、阳陵泉、三阴交、复溜等穴交替选用，以上诸穴均选用平补平泻法，留针30min，经针治10次，未再出现全身瘫软情况，精神转佳，诸症消除。,八脉交会穴为主治疗郁证验案4则,无
