ID,患者编号,个人信息,医师姓名,中医疾病,中药组成,就诊日期,诊次,临床表现,舌质,舌苔,脉象,诊次原文,医案原文
KS7709,ty20190314090128,张某 ，男 ，34岁 ,高上林,,方用小柴胡汤合二陈汤化裁：柴胡、姜半夏、生甘草、竹茹各10g，黄芩6g，陈皮，茯苓各15g，薏苡仁、生山药各30g,,1,5ｄ前不慎受寒，出现恶寒发热，鼻塞流涕，咳嗽，咳痰，自服感冒药后，恶寒发热、鼻塞流涕症状消失，但咳嗽、痰多色黄，口干、口苦，舌红，舌苔黄腻，脉滑数,舌红，,舌苔黄腻,脉滑数,张某，男，34岁，形体肥胖，反复咳嗽、咳痰3ｄ为主诉就诊。5ｄ前不慎受寒，出现恶寒发热，鼻塞流涕，咳嗽，咳痰，自服感冒药后，恶寒发热、鼻塞流涕症状消失，但咳嗽、痰多色黄，口干、口苦，舌红，舌苔黄腻，脉滑数。证属痰热内蕴，治宜清热化痰，方用小柴胡汤合二陈汤化裁：柴胡、姜半夏、生甘草、竹茹各10g，黄芩6g，陈皮，茯苓各15g，薏苡仁、生山药各30g。本方体现祛邪扶正思想，在刘惠霞等使用的“补母止嗽汤”的重要成分之一即为半夏，对久咳患者的疗效十分显著，陈皮理气健脾，现代药理研究表明其挥发油有祛痰、止咳、平喘作用。竹茹加强清热化痰之效，服药6剂而愈。,张某，男，34岁，形体肥胖，反复咳嗽、咳痰3ｄ为主诉就诊。5ｄ前不慎受寒，出现恶寒发热，鼻塞流涕，咳嗽，咳痰，自服感冒药后，恶寒发热、鼻塞流涕症状消失，但咳嗽、痰多色黄，口干、口苦，舌红，舌苔黄腻，脉滑数。证属痰热内蕴，治宜清热化痰，方用小柴胡汤合二陈汤化裁：柴胡、姜半夏、生甘草、竹茹各10g，黄芩6g，陈皮，茯苓各15g，薏苡仁、生山药各30g。本方体现祛邪扶正思想，在刘惠霞等使用的“补母止嗽汤”的重要成分之一即为半夏，对久咳患者的疗效十分显著，陈皮理气健脾，现代药理研究表明其挥发油有祛痰、止咳、平喘作用。竹茹加强清热化痰之效，服药6剂而愈。
KS7710,601889,马某 ，女 ，48 ,柴有华,症瘕,"甘草3g,薄荷3g,龙胆草6g,青皮6g,大青叶10g,香附10g,鸡内金10g,郁金10g,川楝子10g,枸杞10g,生生地10g,麦冬10g,云苓10g,柴胡10g,白术10g,杭芍10g,当归10g,炙鳖甲15g,沙参15g,板兰根15g,",,1,"腹胀,纳呆,全身乏力,口干不欲饮,小便量少,舌质淡红,舌苔薄白,脉细弦",,,,,"何某,女性,65岁,农民,咳嗽气紧反复发作已十余年,每因受凉触发,前数日又着凉致咳嗽怕风,发热,痰涎清稀,气紧不能平卧,纳少神疲,尿少,大便略稀,日下2次,足跗稍肿,西医诊断为肺心病心衰。诊见:面目略浮,唇青舌暗、苔白而滑,脉弦数,双足跗肿,辨证为久病体虚,复感风寒,肺失肃降,水凌心位,渗于肌肤,治当宣肺平喘,补益脾肾,温阳利水,方取真武汤、麻附细辛汤、春泽汤化裁。药用:泡麻黄10g,制附片10g,北细辛5g,白茯苓30g,炒白术10g,北干姜5g,西党参30g,建泽泻15g,朱苓片15g,桂枝尖10g,炙黄芪30g,嘱进2剂。二诊:药后咳嗽气紧减轻,能平卧,寒热已尽,尿增多,续服前方症状消失。"
KS7801,601889,马某 ，女 ，48 ,柴有华,症瘕,,,2,"腹胀乏力减轻,纳食增加,舌质淡红,舌苔薄白,脉细弦",,,,,"何某,女性,65岁,农民,咳嗽气紧反复发作已十余年,每因受凉触发,前数日又着凉致咳嗽怕风,发热,痰涎清稀,气紧不能平卧,纳少神疲,尿少,大便略稀,日下2次,足跗稍肿,西医诊断为肺心病心衰。诊见:面目略浮,唇青舌暗、苔白而滑,脉弦数,双足跗肿,辨证为久病体虚,复感风寒,肺失肃降,水凌心位,渗于肌肤,治当宣肺平喘,补益脾肾,温阳利水,方取真武汤、麻附细辛汤、春泽汤化裁。药用:泡麻黄10g,制附片10g,北细辛5g,白茯苓30g,炒白术10g,北干姜5g,西党参30g,建泽泻15g,朱苓片15g,桂枝尖10g,炙黄芪30g,嘱进2剂。二诊:药后咳嗽气紧减轻,能平卧,寒热已尽,尿增多,续服前方症状消失。"
KS7802,601889,,,,,,,,,,,"何某,女性,65岁,农民,咳嗽气紧反复发作已十余年,每因受凉触发,前数日又着凉致咳嗽怕风,发热,痰涎清稀,气紧不能平卧,纳少神疲,尿少,大便略稀,日下2次,足跗稍肿,西医诊断为肺心病心衰。诊见:面目略浮,唇青舌暗、苔白而滑,脉弦数,双足跗肿,辨证为久病体虚,复感风寒,肺失肃降,水凌心位,渗于肌肤,治当宣肺平喘,补益脾肾,温阳利水,方取真武汤、麻附细辛汤、春泽汤化裁。药用:泡麻黄10g,制附片10g,北细辛5g,白茯苓30g,炒白术10g,北干姜5g,西党参30g,建泽泻15g,朱苓片15g,桂枝尖10g,炙黄芪30g,嘱进2剂。二诊:药后咳嗽气紧减轻,能平卧,寒热已尽,尿增多,续服前方症状消失。","何某,女性,65岁,农民,咳嗽气紧反复发作已十余年,每因受凉触发,前数日又着凉致咳嗽怕风,发热,痰涎清稀,气紧不能平卧,纳少神疲,尿少,大便略稀,日下2次,足跗稍肿,西医诊断为肺心病心衰。诊见:面目略浮,唇青舌暗、苔白而滑,脉弦数,双足跗肿,辨证为久病体虚,复感风寒,肺失肃降,水凌心位,渗于肌肤,治当宣肺平喘,补益脾肾,温阳利水,方取真武汤、麻附细辛汤、春泽汤化裁。药用:泡麻黄10g,制附片10g,北细辛5g,白茯苓30g,炒白术10g,北干姜5g,西党参30g,建泽泻15g,朱苓片15g,桂枝尖10g,炙黄芪30g,嘱进2剂。二诊:药后咳嗽气紧减轻,能平卧,寒热已尽,尿增多,续服前方症状消失。"
KS7803,803748,,,,,,,,,,,邢鉴堂者，嗜酒，年五十余，因咳嗽痰多，形瘦骨立，身热食少力疲，恳治于余。切其脉，细弦而数，舌中光，红而边苔白剥。余曰：君酒劳也，病始于酒，戒酒宜可挽回。其时八月节后也，为之用沙参、天冬、麦冬、川贝、青蒿、地骨、茵陈、生地，或加紫苑（菀）、枇杷，或加龟版、首乌、生耆。四五剂后，身热退，咳嗽减，谷食略增。又以前方改去青蒿、地骨，加阿胶、橘白，五六剂，咳嗽大减，谷食气盛，神健而步履亦轻。再令服燕窝、哈士W，调养至九月底而复原。至除夕，买酒过年，神气健旺，闻酒香而试饮一杯，觉快意沁心，异常爽健。由是元旦复开饮戒，至初十日，自觉前病又来，十二日邀余治。余即辞曰：不可为矣，元宵竟逝。,邢鉴堂者，嗜酒，年五十余，因咳嗽痰多，形瘦骨立，身热食少力疲，恳治于余。切其脉，细弦而数，舌中光，红而边苔白剥。余曰：君酒劳也，病始于酒，戒酒宜可挽回。其时八月节后也，为之用沙参、天冬、麦冬、川贝、青蒿、地骨、茵陈、生地，或加紫苑（菀）、枇杷，或加龟版、首乌、生耆。四五剂后，身热退，咳嗽减，谷食略增。又以前方改去青蒿、地骨，加阿胶、橘白，五六剂，咳嗽大减，谷食气盛，神健而步履亦轻。再令服燕窝、哈士W，调养至九月底而复原。至除夕，买酒过年，神气健旺，闻酒香而试饮一杯，觉快意沁心，异常爽健。由是元旦复开饮戒，至初十日，自觉前病又来，十二日邀余治。余即辞曰：不可为矣，元宵竟逝。
KS7804,ty20200623010005,，女 ，61岁 ,,,,,3,,,,,三诊（2015年4月28日）诉药后咳嗽已愈。,周某，女，61岁，2015年4月14日初诊。主诉，咳嗽发作半年余，咳嗽咽痒，咽干，口干，咽部有堵塞感，咯少量白痰，夜间1点以后咳甚，胃纳欠佳，夜寐欠安，舌苔薄腻淡黄质暗红，脉细。查血白细胞正常，胸片无异常，开始予华盖散未获得效果，拟从”厥阴欲解时”给予乌梅丸化裁，处方：乌梅35g，细辛3g，肉桂（后下）4g，川黄连3g，黄柏10g，当归10g，党参15g，川花椒3g，干姜5g，制附片5g，桔梗5g，甘草5g。7剂。早晚各服1次。二诊（2015年4月21日）时，诉夜1点后咳嗽已除，但仍诉遇凉风则鼻塞流清涕、喷嚏、作咳，且午后3点咽痒作咳为剧，咽干，咳则气急，胃纳可，苔黄质暗红，脉细。结合该年运气特点，考虑肺虚有火，加用紫菀汤合小承气汤：紫菀10g，杏仁10g，党参10g，黄芪15g，桑白皮10g，地骨皮10g，白芍10g，炙甘草5g，桔梗5g，射干10g，牛蒡子10g，薄荷（后下）6g，枳壳10g，厚朴10g，大黄（后下）6g。7剂。早中饭后各服1次。另每晚饭后加服1次原乌梅丸方，3剂。三诊（2015年4月28日）诉药后咳嗽已愈。
KS7805,ty20200623010005,，女 ，61岁 ,,,乌梅35g，细辛3g，肉桂（后下）4g，川黄连3g，黄柏10g，当归10g，党参15g，川花椒3g，干姜5g，制附片5g，桔梗5g，甘草5g,,1,主诉，咳嗽发作半年余，咳嗽咽痒，咽干，口干，咽部有堵塞感，咯少量白痰，夜间1点以后咳甚，胃纳欠佳，夜寐欠安，舌苔薄腻淡黄质暗红，脉细。查血白细胞正常，胸片无异常，开始予华盖散未获得效果，拟从”厥阴欲解时”给予乌梅丸化裁,,舌苔薄腻淡黄质暗红,脉细,周某，女，61岁，2015年4月14日初诊。主诉，咳嗽发作半年余，咳嗽咽痒，咽干，口干，咽部有堵塞感，咯少量白痰，夜间1点以后咳甚，胃纳欠佳，夜寐欠安，舌苔薄腻淡黄质暗红，脉细。查血白细胞正常，胸片无异常，开始予华盖散未获得效果，拟从”厥阴欲解时”给予乌梅丸化裁，处方：乌梅35g，细辛3g，肉桂（后下）4g，川黄连3g，黄柏10g，当归10g，党参15g，川花椒3g，干姜5g，制附片5g，桔梗5g，甘草5g。7剂。早晚各服1次。,周某，女，61岁，2015年4月14日初诊。主诉，咳嗽发作半年余，咳嗽咽痒，咽干，口干，咽部有堵塞感，咯少量白痰，夜间1点以后咳甚，胃纳欠佳，夜寐欠安，舌苔薄腻淡黄质暗红，脉细。查血白细胞正常，胸片无异常，开始予华盖散未获得效果，拟从”厥阴欲解时”给予乌梅丸化裁，处方：乌梅35g，细辛3g，肉桂（后下）4g，川黄连3g，黄柏10g，当归10g，党参15g，川花椒3g，干姜5g，制附片5g，桔梗5g，甘草5g。7剂。早晚各服1次。二诊（2015年4月21日）时，诉夜1点后咳嗽已除，但仍诉遇凉风则鼻塞流清涕、喷嚏、作咳，且午后3点咽痒作咳为剧，咽干，咳则气急，胃纳可，苔黄质暗红，脉细。结合该年运气特点，考虑肺虚有火，加用紫菀汤合小承气汤：紫菀10g，杏仁10g，党参10g，黄芪15g，桑白皮10g，地骨皮10g，白芍10g，炙甘草5g，桔梗5g，射干10g，牛蒡子10g，薄荷（后下）6g，枳壳10g，厚朴10g，大黄（后下）6g。7剂。早中饭后各服1次。另每晚饭后加服1次原乌梅丸方，3剂。三诊（2015年4月28日）诉药后咳嗽已愈
KS7806,ty20200623010005,，女 ，61岁 ,,,紫菀10g，杏仁10g，党参10g，黄芪15g，桑白皮10g，地骨皮10g，白芍10g，炙甘草5g，桔梗5g，射干10g，牛蒡子10g，薄荷（后下）6g，枳壳10g，厚朴10g，大黄（后下）6g。,,2,（2015年4月21日）时，诉夜1点后咳嗽已除，但仍诉遇凉风则鼻塞流清涕、喷嚏、作咳，且午后3点咽痒作咳为剧，咽干，咳则气急，胃纳可，苔黄质暗红，脉细,,苔黄质暗红，脉细,脉细,二诊（2015年4月21日）时，诉夜1点后咳嗽已除，但仍诉遇凉风则鼻塞流清涕、喷嚏、作咳，且午后3点咽痒作咳为剧，咽干，咳则气急，胃纳可，苔黄质暗红，脉细。结合该年运气特点，考虑肺虚有火，加用紫菀汤合小承气汤：紫菀10g，杏仁10g，党参10g，黄芪15g，桑白皮10g，地骨皮10g，白芍10g，炙甘草5g，桔梗5g，射干10g，牛蒡子10g，薄荷（后下）6g，枳壳10g，厚朴10g，大黄（后下）6g。7剂。早中饭后各服1次。另每晚饭后加服1次原乌梅丸方，3剂。,周某，女，61岁，2015年4月14日初诊。主诉，咳嗽发作半年余，咳嗽咽痒，咽干，口干，咽部有堵塞感，咯少量白痰，夜间1点以后咳甚，胃纳欠佳，夜寐欠安，舌苔薄腻淡黄质暗红，脉细。查血白细胞正常，胸片无异常，开始予华盖散未获得效果，拟从”厥阴欲解时”给予乌梅丸化裁，处方：乌梅35g，细辛3g，肉桂（后下）4g，川黄连3g，黄柏10g，当归10g，党参15g，川花椒3g，干姜5g，制附片5g，桔梗5g，甘草5g。7剂。早晚各服1次。二诊（2015年4月21日）时，诉夜1点后咳嗽已除，但仍诉遇凉风则鼻塞流清涕、喷嚏、作咳，且午后3点咽痒作咳为剧，咽干，咳则气急，胃纳可，苔黄质暗红，脉细。结合该年运气特点，考虑肺虚有火，加用紫菀汤合小承气汤：紫菀10g，杏仁10g，党参10g，黄芪15g，桑白皮10g，地骨皮10g，白芍10g，炙甘草5g，桔梗5g，射干10g，牛蒡子10g，薄荷（后下）6g，枳壳10g，厚朴10g，大黄（后下）6g。7剂。早中饭后各服1次。另每晚饭后加服1次原乌梅丸方，3剂。三诊（2015年4月28日）诉药后咳嗽已愈。
KS7807,759509,,,,,,,,,,,女患，59岁，病历号4926，1987年1月9日初诊。患者咳嗽吐白粘痰20年余，1965年因患外感致咳嗽咳唾白沫，痰量多，曾服中西药效果甚微。今年初无明显诱因，病情加重，夜间不能平卧，胸闷，咽痛，面部轻度浮肿，纳差便干，大便3天一行，尿黄，苔薄白，脉沉滑。既往有糖尿病史。证属痰湿内停，肺失宣降，治以宣肺化痰，降气止咳之法，方用：草河车10克，杏仁10克，桑叶、桑皮各10克，生地10克，玄参10克，前胡10克，赤芍10克，丹皮10克，苦桔梗10克，半夏10克，茯苓15克，桔红10克，炒莱菔子10克，苏子10克，白芥子10克，麻黄5克。二诊时痰涎减少，胸闷减轻，咳嗽略减。仍咽干，大便干，脉沉滑，苔薄白。上方去生地、丹皮，加五味子10克，细辛2克，七剂。药后咳嗽大减，吐少量痰，夜间已能平卧，食欲转佳，大便干，脉沉弦，苔薄白。上方去五味子，细辛、苏子，加紫苑10克，冬花10克，百部10克，在主方基础上加减治疗2个半月病乃愈。,女患，59岁，病历号4926，1987年1月9日初诊。患者咳嗽吐白粘痰20年余，1965年因患外感致咳嗽咳唾白沫，痰量多，曾服中西药效果甚微。今年初无明显诱因，病情加重，夜间不能平卧，胸闷，咽痛，面部轻度浮肿，纳差便干，大便3天一行，尿黄，苔薄白，脉沉滑。既往有糖尿病史。证属痰湿内停，肺失宣降，治以宣肺化痰，降气止咳之法，方用：草河车10克，杏仁10克，桑叶、桑皮各10克，生地10克，玄参10克，前胡10克，赤芍10克，丹皮10克，苦桔梗10克，半夏10克，茯苓15克，桔红10克，炒莱菔子10克，苏子10克，白芥子10克，麻黄5克。二诊时痰涎减少，胸闷减轻，咳嗽略减。仍咽干，大便干，脉沉滑，苔薄白。上方去生地、丹皮，加五味子10克，细辛2克，七剂。药后咳嗽大减，吐少量痰，夜间已能平卧，食欲转佳，大便干，脉沉弦，苔薄白。上方去五味子，细辛、苏子，加紫苑10克，冬花10克，百部10克，在主方基础上加减治疗2个半月病乃愈。
KS7808,ty20200624011128,，男 ，69岁 ,姚云任,,原方去紫草、胆星，加桔梗10g、甘草5g。上方：芦根50g，大黄5g，胆星10g，紫草10g，茜草15g，冬瓜仁15g，赤芍9g，茅根15g，苡米30g,,2,(4月16日)：患者服上药后觉有微微汗出，周身轻快，畏寒消失，咳嗽气促与胸闷痛均减轻，痰转稀薄，且易咯出，大便软畅，食欲亦有好转，原方去紫草、胆星，加桔梗10g、甘草5g,,,,二诊(4月16日)：患者服上药后觉有微微汗出，周身轻快，畏寒消失，咳嗽气促与胸闷痛均减轻，痰转稀薄，且易咯出，大便软畅，食欲亦有好转，原方去紫草、胆星，加桔梗10g、甘草5g。4剂。,"姚某,男,69岁,退休职工,2008年4月12日就诊。患者既往有慢性支气管炎和肺气肿病史20余年。于1周前夜卧着凉后,咳嗽吐痰加重,胸闷气急,畏寒(无发热),周身疼痛,自己购服头孢氨苄、罗红霉素、复方甘草片等药多日,病不见减。现症:胃寒喜暖,咳嗽气促,咳甚面赤,痰黄带绿,腥臭不爽,胸闷隐痛,食欲减退,大便秘结,舌质红,苔黄,脉浮滑。摄胸片示:慢性阻塞性肺疾病并感染。实验室检查:血常规WBC13.2×109/L,中性粒细胞0.88。方用:芦根50g，大黄5g，胆星10g，紫草10g，茜草15g，冬瓜仁15g，赤芍9g，茅根15g，苡米30g。每日1剂,水煎服。3剂。二诊(4月16日):患者服上药后觉有微微汗出,周身轻快,畏寒消失,咳嗽气促与胸闷痛均减轻,痰转稀薄,且易咯出,大便软畅,食欲亦有好转,原方去紫草、胆星,加桔梗10g、甘草5g。4剂。三诊(4月21日):咳嗽气促胸闷近平,痰少,稀薄无臭,且畅出,饮食及二便正常。上方出入再进3剂,善后而愈。"
KS7809,2.01811E+12,,,哮喘,,,,,,,,右（正号）　咳嗽痰吐如沫，发则气急，不能安卧，脉左细、右软滑数。病根积深，不易速效。兼之腹瘕上逆，法当两顾。 旋覆花三钱五分，绢包　紫菀三钱五分，蜜炙冬瓜子一两　瓜蒌皮三钱　代赭石四钱，先煎　款冬花三钱五分，炙　白前三钱五分　茯苓四钱　煅瓦楞粉一两，包　白杏仁四钱，去尖　象贝四钱，去心　生米仁三钱（咳嗽门） ,右（正号）　咳嗽痰吐如沫，发则气急，不能安卧，脉左细、右软滑数。病根积深，不易速效。兼之腹瘕上逆，法当两顾。 旋覆花三钱五分，绢包　紫菀三钱五分，蜜炙冬瓜子一两　瓜蒌皮三钱　代赭石四钱，先煎　款冬花三钱五分，炙　白前三钱五分　茯苓四钱　煅瓦楞粉一两，包　白杏仁四钱，去尖　象贝四钱，去心　生米仁三钱（咳嗽门） 
KS7810,589124,,,,,,,,,,,"江某,男,47岁。咳嗽短气,大汗如洗,昼夜不止,心中怔忡,其脉微弱欲无。张锡纯审之为大气下陷,投以升陷汤加生龙骨、生牡蛎各15g,3剂痊愈。按：本证咳嗽短气,因大气下陷,肺失其职。大气下陷,卫表不固,故汗出如洗。大气下陷,心中失养,故怔忡不止。脉微弱欲无为大气下陷之脉。因汗出不止,故加生龙骨、生牡蛎以敛汗。","江某,男,47岁。咳嗽短气,大汗如洗,昼夜不止,心中怔忡,其脉微弱欲无。张锡纯审之为大气下陷,投以升陷汤加生龙骨、生牡蛎各15g,3剂痊愈。按：本证咳嗽短气,因大气下陷,肺失其职。大气下陷,卫表不固,故汗出如洗。大气下陷,心中失养,故怔忡不止。脉微弱欲无为大气下陷之脉。因汗出不止,故加生龙骨、生牡蛎以敛汗。"
KS7901,ty20190314070749,，女 ，37岁 ,王玉英,,前方去前胡、苏叶，加生牡蛎30g，天麻20g。上方：柴胡12g，炒黄芩10g，清半夏15g，陈皮12g，茯苓20g，竹茹10g，枳实12g，前胡12g，桔梗12g，苏叶梗各12g，厚朴15g，杏仁12g，麻黄5g，甘草10g,,2,2010年3月20日,,,脉沉略滑,二诊：2010年3月20日。药后心悸好转，咳嗽基本痊愈，大便已不干，眠差，舌尖红，脉沉略滑。处方：因患者药后咳嗽基本痊愈，但仍眠差，故减宣降肺气之药，加用镇静安神之药。因此，前方去前胡、苏叶，加生牡蛎30g，天麻20g。14剂，1日1剂，水煎服。又续服20剂，心悸等症状基本消失，随访观察半年，未见发作。,张某，女，37岁。初诊:2010年3月12日。患者因心悸就诊，伴咳嗽少痰、喘1周余，入睡后咽部不适，易醒眠差，大便秘结，舌红苔黄，脉滑。处方:柴胡12g，炒黄芩10g，清半夏15g，陈皮12g，茯苓20g，竹茹10g，枳实12g，前胡12g，桔梗12g，苏叶梗各12g，厚朴15g，杏仁12g，麻黄5g，甘草10g。7剂，1日1剂，水煎服。二诊:2010年3月20日。药后心悸好转，咳嗽基本痊愈，大便已不干，眠差，舌尖红，脉沉略滑。处方:因患者药后咳嗽基本痊愈，但仍眠差，故减宣降肺气之药，加用镇静安神之药。因此，前方去前胡、苏叶，加生牡蛎30g，天麻20g。14剂，1日1剂，水煎服。又续服20剂，心悸等症状基本消失，随访观察半年，未见发作。按:此属痰火扰心型，故用清热化痰法。初诊方中用柴芩温胆汤清热化痰、宁心安神，配以前胡、苏叶梗、杏仁、厚朴宣降肺气、化痰止咳。二诊时，患者心悸好转、咳嗽基本痊愈，但仍眠差，故只需在前方基础上加用镇静安神之药(如生牡蛎、天麻)。
KS7902,ty20190314070749,，女 ，37岁 ,王玉英,,柴胡12g，炒黄芩10g，清半夏15g，陈皮12g，茯苓20g，竹茹10g，枳实12g，前胡12g，桔梗12g，苏叶梗各12g，厚朴15g，杏仁12g，麻黄5g，甘草10g,,,伴咳嗽少痰、喘1周余，入睡后咽部不适，易醒眠差，大便秘结，舌红苔黄，脉滑,舌红,苔黄,脉滑,张某，女，37岁。初诊：2010年3月12日。患者因心悸就诊，伴咳嗽少痰、喘1周余，入睡后咽部不适，易醒眠差，大便秘结，舌红苔黄，脉滑。处方：柴胡12g，炒黄芩10g，清半夏15g，陈皮12g，茯苓20g，竹茹10g，枳实12g，前胡12g，桔梗12g，苏叶梗各12g，厚朴15g，杏仁12g，麻黄5g，甘草10g。7剂，1日1剂，水煎服。,张某，女，37岁。初诊:2010年3月12日。患者因心悸就诊，伴咳嗽少痰、喘1周余，入睡后咽部不适，易醒眠差，大便秘结，舌红苔黄，脉滑。处方:柴胡12g，炒黄芩10g，清半夏15g，陈皮12g，茯苓20g，竹茹10g，枳实12g，前胡12g，桔梗12g，苏叶梗各12g，厚朴15g，杏仁12g，麻黄5g，甘草10g。7剂，1日1剂，水煎服。二诊:2010年3月20日。药后心悸好转，咳嗽基本痊愈，大便已不干，眠差，舌尖红，脉沉略滑。处方:因患者药后咳嗽基本痊愈，但仍眠差，故减宣降肺气之药，加用镇静安神之药。因此，前方去前胡、苏叶，加生牡蛎30g，天麻20g。14剂，1日1剂，水煎服。又续服20剂，心悸等症状基本消失，随访观察半年，未见发作。按:此属痰火扰心型，故用清热化痰法。初诊方中用柴芩温胆汤清热化痰、宁心安神，配以前胡、苏叶梗、杏仁、厚朴宣降肺气、化痰止咳。二诊时，患者心悸好转、咳嗽基本痊愈，但仍眠差，故只需在前方基础上加用镇静安神之药(如生牡蛎、天麻)。
