ID,医师姓名,西医疾病,中医疾病,中医证候,医案原文,医案来源
SM1101,颜正华,功能性便秘,便秘,湿毒,某女，42岁。2007年1月初诊。患尿毒症7年余，每周血液透析2次。大便干燥，2天1次，两，胁胀满，后背热，失眠、入睡困难，纳可，无小便，面色晦暗，乏力倦怠，舌暗、苔白，脉细。证属湿毒久连，气机不扬。治以行气通腑，疏肝消胀，利湿排毒，兼以安神。处方：柴胡、香附各10g，车前子（包煎）、赤芍药各15g，怀牛膝、郁金各12g，青皮、陈皮各8g，枳壳、枳实、生大黄（后下)各6g，炒酸枣仁、夜交藤各30g。7剂，每天1剂，水煎服。嘱若大便每天超过4次则停用大黄。二诊：大便每天1次，胁胀减轻，失眠好转，面色转佳，仍觉后背热。治以通腑疏肝排毒，佐以安神。处方：生龙骨（先煎）、生牡蛎（先煎）、炒酸枣仁、夜交藤各30g，炒栀子、柴胡、香附各10g，赤芍药、车前子（包煎）各15g，怀牛膝、郁金各12g，青皮、陈皮、黄柏、枳壳、枳实、生大黄（后下)各6g。每天1剂，水煎服。药后大便每天1次，面色较前好转，余症亦减。继续予上方加减调理。,国医大师验案良方.学苑出版社.2010年7月第1版次
SM1104,陈可冀,高血压病2级；胃十二指肠溃疡,眩晕,?肝阳上亢,"患者华某，男性，40岁，北京某电脑开发公司副总裁，主诉因头晕耳鸣半年余于2004年4月14日来诊。 患者半年前因胃出血住院时发现血压偶有升高。两个月后复查，发现血压持续升高，最高时165/100mmHg,口服洛丁新、倍他乐克后改为代文、达力全，血压基本维持在110～130/75～85mmHg,水平。现头晕，耳鸣如蝉，心烦，失眠，常服安定维持睡眠，食纳二便可。既往有先天性心脏病史。查体：舌暗、苔白微腻，脉沉弦。血压110/85mmHg,心率72次/分。中医诊断：眩晕，肝阳上亢；西医诊断：高血压病2级，胃十二指肠溃疡。治疗原则：平肝清热，潜阳熄风。处方：清眩降压汤加减：天麻30g,钩藤20g,苦丁茶30g,夏枯草20g,杭菊花20g,杜仲30g,莲子心10g,黄芩12g,蝉衣12g,冬桑叶30g,白蒺藜20g,生石决明30g,珍珠母20g,。并处方代茶饮酌量频服，处方：杭菊花20g,冬桑叶30g,莲子心10g,。4月21日二诊：自觉耳鸣、夜眠均有好转。查舌红较前变浅。加生石决明30g,葛根30g,以加强镇静降压之功。4月28日三诊：耳鸣只在用力发声时较为明显，查舌略红、苔薄，脉弦细。前方加用白僵蚕12g,炒枣仁30g,。5月17日四诊：基本无不适主诉，予前方继用7剂以调理使用。 按：近年来随着人们生活水平的提高及社会竞争的不断加剧，高血压已经不再是中老年的罹患疾病，轻中年原发性高血压病的患病率也明显上升。本类患者多性情不稳、脾气急躁或性格内向，属中医之肝郁气滞或肝火偏亢型素质。陈老师治疗本型患者常选用天麻钩藤饮或自拟清眩降压汤加减。本案患者正值青壮年，工作紧张，具有头晕、耳鸣如蝉、心烦、失眠等症状，辨以肝阳上亢，选用天麻钩藤饮及清眩降压汤加减甚为恰当。在此基础上加用莲子心清心除烦，夏枯草清肝泻热，均为现代药理学证实其具有明确降压作用的药物。二者合用治疗心烦失眠效果明显。诸药合用，进退有度，既符合中医学辨证论治之机理，又与现代药理学的研究结果相吻合。",陈可冀名医传承工作站
SM1106,?李辅仁,?眩晕,眩晕,"虚,肝阳上亢,肾阴虚,肝肾阴虚",汗出心悸，少气懒言，舌质淡红，苔薄白，诊其脉沉细弦，尺脉尤弱。证属肝肾阴虚，肝阳上亢。治以滋水涵木，用平肝潜阳之“乙癸汤”。方药如下：灵磁石20g（先煎)，焦神曲10g，生牡蛎30g，枸杞子10g，山萸肉10g，牡丹皮10g，泽泻10g，山药10g，熟地黄15g，茯苓15g，菊花10g，桑椹15g。7剂。日1剂，水煎服。二诊：服药后，睡眠香甜，脑鸣减轻，汗出减少，原方连服14剂。三诊：服药后，眩晕脑鸣消失，汗出已止，精神渐振。原方再服10剂，巩固疗效。,国医大师验案良方.学苑出版社.2010年7月第1版次
SM1110,段富津,糖尿病并发症,劳嗽,津亏,关某， 女， 64 岁， 2003 年 9 月 19 日初诊。患糖尿病 10余年， 长期口服西药降糖药， 血糖维持在 6~ 8mmol/ L 之间， 2 年前患结核病， 后经系统抗结核治疗。现口渴咽干， 干咳少痰， 痰粘而不易咳出， 或痰中带血， 潮热盗汗， 消瘦乏力， 心烦失眠， 手足心热， 倦怠乏力， 舌红少苔， 脉细数无力。处方: 生地 20g， 熟地20g， 当归 15g， 百部 10g， 百合 15g， 玄参 15g， 麦冬 15g，桔梗15g， 川贝母 15g， 地骨皮20g， 黄芪 25g， 知母 15g，甘草15g， 7 剂， 水煎服。9 月 26 日二诊: 服药一周后，明显好转， 诸症减轻， 守方继服 14 剂。三诊时， 持续好转， 后以本方调治2 月， 诸症消失。按: 金# 刘河间在《三消论》中把/ 虚热盗汗， 肺痿劳嗽0作为消渴病兼证论述。本例病程较长， 形成肺肾阴亏， 虚火上炎之证。阴津亏虚， 则口渴咽干， 干咳少痰， 痰粘而不易咳出; 虚火上炎， 而见潮热盗汗， 心烦失眠， 手足心热; 热伤肺络则痰中带血; 热伤气阴则倦怠乏力， 舌红少苔， 脉细数无力。故治宜养阴清热， 润肺止咳， 方选百合固金汤加味。其中二地为君， 滋补肾阴， 生地且能凉血。百合、麦冬、川贝母为臣， 润肺止咳。佐以玄参、知母、地骨皮滋阴清热; 当归养血和阴;百部、桔梗化痰止咳。久病气阴两，虚， 故加黄芪补气;甘草调和诸药为使。本方既能治疗劳咳， 同时亦能治疗消渴， 有标本同治之效。,"?赵雪莹,李冀.段富津教授辨治糖尿病并发症验案举隅[J].云南中医中药杂志,2007(9):1-3."
SM1205,张琪,抑郁症,癫证,"血瘀,气虚",李某，女，27岁。2001年4月17日初诊。病因情志不遂，日久不解，遂致失眠，阵喜笑不休，阵又发怒不能控制。由某精神病院确诊为精神分裂症，用冬眠灵、卡马西平初期有一定效果，但逐渐失去作用，症状逐渐加重，加量亦无效。表情呆板、苦闷，默默不语，舌体胖大，质紫黯有瘀斑，苔白腻，脉滑有力。辨证为气虚，肝气郁血瘀，痰浊扰于神明。治宜养心疏肝，活血化痰浊法。药用：小麦20g，甘草25g，红枣5枚，柴胡15g，半夏20g，陈皮15g，紫苏子25g，赤芍药20g，胆南星15g，郁金15g，石菖蒲15g，大黄10g，水煎日2次服。服药28剂，睡眠明显改善，能入睡，一夜8小时，但有时多梦，心烦不宁。无端喜笑及愤怒近2周末出现，精神状态稳定；现头昏，记忆力差，舌紫苔薄，瘀斑已无，效不更方。再服14剂，睡眠状态明显改善，不用安眠药能入睡，一夜6～7小时，精神稳定，症状基本消失，家属及病人均要求继续服药，巩固疗效。再服14剂，一切如平人，随访半年，状态稳定。,?国医大师验案良方.学苑出版社.2010年7月第1版次
SM1207,路志正,尿路感染,劳淋,上热下寒,李某某，女，38岁。1994年12月2日初诊。患者近1年来由于工作紧张、劳累反复出现小便淋漓不已，多次查尿常规均见红、白细胞，肾功能正常，诊为泌尿系感染，服氟哌酸、呋喃坦叮等多种抗生素及清热利湿中药均未见大效，请路老诊治。刻诊：小便淋漓不已，尿道涩痛，少腹坠胀，劳则加剧；心悸气短，倦怠乏力，腰膝冷痛，失眠多梦，口干咽燥，舌尖红、苔薄黄，脉细弦尺弱。查尿常规：红细胞2～3个/高倍视野，白细胞8～15个/高倍视野。辨证为气阴两，虚，上热下寒，治以益气养阴，清上温下。药物组成：太子参12g，生黄芪15g，地骨皮10g，麦门冬10g，莲肉12g，柴胡12g，赤茯苓12g，车前子12g（包煎），仙灵脾12g，泽泻10g，乌药9g，益智仁6g（后入）。水煎，日1剂。二诊：上方6剂后，小便淋漓不已即愈，余症亦明显减轻，仍宗前法继进12剂以善其后，复查尿常规正常。随访1年，未再复发。,国医大师验案良方.学苑出版社.2010年7月第1版次
SM1301,郭子光,心律失常,心悸,气虚,?汪某某，女，48岁，家庭妇女。1993年10月27日初诊。病史：有长期吸烟史，1周前自觉心悸、心慌、心空，头晕，失眠，气短、乏力。随即去当地县医院诊治，心电图检查结果：“频发室性期前收缩、下壁心肌缺血”。服用心律平、丹参片等无效而来求治。诊见：仍觉心悸、心慌，心空、胸闷塞，心烦，气短乏力，时时太息，头晕，眠差，饮食尚可，二便正常。察其形体偏瘦，精神欠佳，舌质淡有痰点，苔薄白少津，脉促细而无力。血压12/8kPa。辨治：气虚血弱，心失滋养而夹瘀滞。用炙甘草汤加味：红人参15g，炙甘草10g，麦门冬30g，阿胶15g（烊服)，生地黄20g，桂枝10g，生姜10g，酸枣仁15g，大枣15g，黄芪30g，丹参20g。每日1剂，水煎服。7月11日复诊：上方服4剂，诸证缓解，又自配原方再服2剂后，去原医院复查心电图，结果正常。诊其脉率数（80次／分）细而有力，脉律正常。以上方予服6剂善后。随访2年余未复发。,国医大师验案良方.学苑出版社.2010年7月第1版次
