ID,患者编号,个人信息,医师姓名,中医疾病,中药组成,就诊日期,诊次,临床表现,舌质,舌苔,脉象,诊次原文,医案原文
KS7606,81603,，男 ，10岁 ,徐荣谦,,药物，嘱不适随诊,,3,,,,,三诊：2018年6月18日。家长描述：咳嗽基本痊愈。患儿不喜中药，未予药物，嘱不适随诊。观察随访数月，患儿咳嗽未再反复。家长述治疗后患儿学习成绩明显上升，精力较从前有所上升，自信心、精神状态都相应的有所提升。,患者甲，男，10岁。初诊：2018年6月9日。患儿自幼常发热，气管炎经常发作，平时多使用抗生素、输液、雾化等西医治疗，尚且不能断根。于昨日夜间发热，体温未测，家长给其口服退热药一次，烧退变喘，来我中医科就诊。刻下症见：咳嗽，呼吸微重促。纳差，眠差，二便正常。查：面色不泽，双目不灵活，口唇黑红，毛发干枯无泽，身上皮肤黑黄，双目下眼睑泛黑色。咽部微红。听诊：双肺湿音。舌质淡嫩，舌尖微红，苔白水滑，根部厚腻。脉沉细软。中医诊断：小儿咳嗽（肾虚水气上浮，肺气不宣）。西医诊断：小儿支气管炎。治法：补肾制水，宣肺豁痰。方药：金匮肾气丸加减。处方：生地黄15g，熟地黄15g，山药4g，山茱萸4g，牡丹皮4g，茯苓9g，泽泻9g，炮附子3g，桂枝1g，焦栀子6g，淡豆豉6g，苏叶6g，苏子6g，苏梗6g，干姜1g，五味子2g，芦根30g，鲜竹沥（兑）10mL。3剂，水煎服，每日一剂，分3次服。二诊：2018年6月11日。家长描述咳嗽好转，呼吸已平稳，刻下症见：咳嗽明显好转，呼吸微重促好转，纳少可，睡眠好转，能够平稳睡眠。查：面色略有红润，双目灵活，口唇黑红，毛发干枯无泽，身上皮肤黑黄，双目下眼睑泛黑色。咽扁（-），听诊双肺（-），舌质淡嫩，舌尖微红，苔白水滑，根部厚腻已化，脉细软。精神稍振奋，尚且不足。诊断：小儿咳嗽（肾虚体质，精气不足）。方药：金匮肾气丸加减。处方：生地黄15g，熟地黄15g，山药4g，山茱萸4g，牡丹皮4g，茯苓9g，泽泻9g，炮附子6g，芦根30g，桂枝1g，焦栀子6g，淡豆豉6g，干姜1g，五味子2g，柴胡1.5g，鲜竹沥10mL。7剂，水煎服，每日一剂，分3次服。三诊：2018年6月18日。家长描述：咳嗽基本痊愈。患儿不喜中药，未予药物，嘱不适随诊。观察随访数月，患儿咳嗽未再反复。家长述治疗后患儿学习成绩明显上升，精力较从前有所上升，自信心、精神状态都相应的有所提升。按：该患儿经常发作支气管炎，影响正常的生长发育；长期运用西药激素、抗生素产生了耐药性，支气管炎没有得到根本性的治疗。家长无奈转看中医，患儿虽然是气管炎急性发作，但是从其面容、舌象、脉象，基本符合徐荣谦教授所提出的肾虚体质。肾主水，肾脏统制一身之水气。虽属于气管炎急性发作，但中医辨证以肾虚为主。故用金匮肾气丸原方加减补肾宣肺化痰，取得了良好的疗效。家长述患儿经治疗后咳嗽痊愈，学习成绩有所提升，精力、自信心、精神状态都有所好转。
KS7607,2.01811E+12,,,痢疾,,,,,,,,许三三　劳倦咳嗽失血，仍然不避寒暑，食物腹中泻痢，病上加病，后感，法当先治，以分病有新旧。阳虚 厚朴　益智　广皮　茯苓皮　白芍　炙草　木瓜　炒扁豆 又　咳嗽泻痢，药治相背，治肺碍脾，治脾碍肺，方今交冬，治痢为要。病患说早食相安，晚食胀满，脾胃阳气已乏，勿徒消滞寒克矣。 白芍桂酒拌　益智　广皮　茯苓　焦白术　炙草　谷芽　砂仁壳 ,许三三　劳倦咳嗽失血，仍然不避寒暑，食物腹中泻痢，病上加病，后感，法当先治，以分病有新旧。阳虚 厚朴　益智　广皮　茯苓皮　白芍　炙草　木瓜　炒扁豆 又　咳嗽泻痢，药治相背，治肺碍脾，治脾碍肺，方今交冬，治痢为要。病患说早食相安，晚食胀满，脾胃阳气已乏，勿徒消滞寒克矣。 白芍桂酒拌　益智　广皮　茯苓　焦白术　炙草　谷芽　砂仁壳 
KS7608,ty20190516020116,,丁济万,虚损案,炙黄芪二钱 潞党参三钱 云茯苓三钱 怀山药三钱 清炙草五分 陈皮一钱 炒诃子皮二钱 炒御米壳二钱 北秫米三钱（包） 炒於术 炒川象贝,,,,,,,王 外寒内热，咳嗽便溏，经云：阳虚则外寒，阴虚则内热。肺虚则咳嗽，脾虚则便溏，心虚则脉细，五虚俱见已入损门，治当损者益之，虚则补之，调养中焦，冀其便结能食为安。 炙黄芪二钱 潞党参三钱 云茯苓三钱 怀山药三钱 清炙草五分 陈皮一钱 炒诃子皮二钱 炒御米壳二钱 北秫米三钱（包） 炒於术 炒川象贝,王 外寒内热，咳嗽便溏，经云：阳虚则外寒，阴虚则内热。肺虚则咳嗽，脾虚则便溏，心虚则脉细，五虚俱见已入损门，治当损者益之，虚则补之，调养中焦，冀其便结能食为安。 炙黄芪二钱 潞党参三钱 云茯苓三钱 怀山药三钱 清炙草五分 陈皮一钱 炒诃子皮二钱 炒御米壳二钱 北秫米三钱（包） 炒於术 炒川象贝
KS7609,2.01811E+12,,,哮喘,,,,,,,,右（正号）　咳嗽痰吐如沫，发则气急，不能安卧，脉左细、右软滑数。病根积深，不易速效。兼之腹瘕上逆，法当两顾。 旋覆花三钱五分，绢包　紫菀三钱五分，蜜炙冬瓜子一两　瓜蒌皮三钱　代赭石四钱，先煎　款冬花三钱五分，炙　白前三钱五分　茯苓四钱　煅瓦楞粉一两，包　白杏仁四钱，去尖　象贝四钱，去心　生米仁三钱（咳嗽门） ,右（正号）　咳嗽痰吐如沫，发则气急，不能安卧，脉左细、右软滑数。病根积深，不易速效。兼之腹瘕上逆，法当两顾。 旋覆花三钱五分，绢包　紫菀三钱五分，蜜炙冬瓜子一两　瓜蒌皮三钱　代赭石四钱，先煎　款冬花三钱五分，炙　白前三钱五分　茯苓四钱　煅瓦楞粉一两，包　白杏仁四钱，去尖　象贝四钱，去心　生米仁三钱（咳嗽门） 
KS7610,589124,,,,,,,,,,,"江某,男,47岁。咳嗽短气,大汗如洗,昼夜不止,心中怔忡,其脉微弱欲无。张锡纯审之为大气下陷,投以升陷汤加生龙骨、生牡蛎各15g,3剂痊愈。按：本证咳嗽短气,因大气下陷,肺失其职。大气下陷,卫表不固,故汗出如洗。大气下陷,心中失养,故怔忡不止。脉微弱欲无为大气下陷之脉。因汗出不止,故加生龙骨、生牡蛎以敛汗。","江某,男,47岁。咳嗽短气,大汗如洗,昼夜不止,心中怔忡,其脉微弱欲无。张锡纯审之为大气下陷,投以升陷汤加生龙骨、生牡蛎各15g,3剂痊愈。按：本证咳嗽短气,因大气下陷,肺失其职。大气下陷,卫表不固,故汗出如洗。大气下陷,心中失养,故怔忡不止。脉微弱欲无为大气下陷之脉。因汗出不止,故加生龙骨、生牡蛎以敛汗。"
KS7701,871084,,,,,,,,,,,某，女，40岁。2018年4月11日初诊。平素畏寒喜暖，近日因不慎受凉后咽痒干咳伴背凉，舌苔白，脉浮滑。西医诊断:急性支气管炎。中医诊断:咳嗽。证属痰饮伏肺型。治以疏风解表，温肺化饮，益气固本。拟方:炙麻黄10g、干姜10g、姜半夏15g、炒白芍15g、桂枝15g、细辛5g、五味子10g、炙甘草10g、前胡15g、白前15g、当归15g、桔梗20g、紫菀30g、款冬花10g、生姜10g。14剂，每日1剂，水煎早晚分服。2018年5月6日二诊，咳嗽已轻，背凉即发，前方加生黄芪30g、淫羊藿30g。2019年4月28日，患者因受凉后咳嗽来诊，诉前方服后咳嗽即愈。按:急性支气管炎通常是由于病原体感染或化学刺激引起的呼吸道症状，临床表现主要为咳嗽，咽喉肿痛等。其对呼吸道具有反射性的保护作用，但长期的不愈会严重影响生活和工作。本病归属于中医“咳嗽”“哮喘”等范畴。《丹溪心法》云“干咳嗽，难治。此系火郁之证，乃痰郁其中，邪在中”。本案虽为干咳无痰之表象，实为痰郁于肺之病机。畏寒喜暖，背凉，白苔提示该患者为阳虚体质，故肺的宣肃、脾的运化以及肾的开合功能均失司，痰饮内生伏于肺。受凉后表寒引动内饮致肺宣降失常而发咳嗽，外邪夹痰饮伏留肺络，津液无法上乘则咽痒干咳。《伤寒论》第四十条云:“伤寒表不解，心下有水气，干呕发热而咳，或渴，或利，或噎，或小便不利、少腹满，或喘者，小青龙汤主之”。张老师灵活运用小青龙汤化裁治疗，标本兼顾，收效甚捷。方中炙麻黄与桂枝相须相使，发散风寒与化气利水表里双解;干姜、细辛、姜半夏温化寒饮，并助麻黄、桂枝散表邪;五味子敛肺止咳、炒白芍益阴敛营，二药相合以防辛温药发散太过;炒白芍与桂枝炙甘草配伍取桂枝汤外发汗解表，内调和营卫之意;前胡、白前、桔梗、紫菀、款冬花、生姜共奏温肺下气，止咳化痰之功，寒凉之性的前胡既风散邪，又兼反佐，以防药物格拒的作用;肺与大肠互为表里，当归通过养血润肠通便以降逆肺气;二诊重用生黄芪、淫羊藿益气固表，固本培元。本案体现了张老师临证攻守取舍有方，培补正气与患者身体素质常有机结合。该患者虽呈现一派阳气不足之象，但正气尚能耐攻。如此时加入过多的益气扶正药，恐会有助邪发展之嫌。故而一诊以祛邪为主，少辅扶正之品，待二诊邪气之势基本已去再加大健脾益肾之力度。,某，女，40岁。2018年4月11日初诊。平素畏寒喜暖，近日因不慎受凉后咽痒干咳伴背凉，舌苔白，脉浮滑。西医诊断:急性支气管炎。中医诊断:咳嗽。证属痰饮伏肺型。治以疏风解表，温肺化饮，益气固本。拟方:炙麻黄10g、干姜10g、姜半夏15g、炒白芍15g、桂枝15g、细辛5g、五味子10g、炙甘草10g、前胡15g、白前15g、当归15g、桔梗20g、紫菀30g、款冬花10g、生姜10g。14剂，每日1剂，水煎早晚分服。2018年5月6日二诊，咳嗽已轻，背凉即发，前方加生黄芪30g、淫羊藿30g。2019年4月28日，患者因受凉后咳嗽来诊，诉前方服后咳嗽即愈。按:急性支气管炎通常是由于病原体感染或化学刺激引起的呼吸道症状，临床表现主要为咳嗽，咽喉肿痛等。其对呼吸道具有反射性的保护作用，但长期的不愈会严重影响生活和工作。本病归属于中医“咳嗽”“哮喘”等范畴。《丹溪心法》云“干咳嗽，难治。此系火郁之证，乃痰郁其中，邪在中”。本案虽为干咳无痰之表象，实为痰郁于肺之病机。畏寒喜暖，背凉，白苔提示该患者为阳虚体质，故肺的宣肃、脾的运化以及肾的开合功能均失司，痰饮内生伏于肺。受凉后表寒引动内饮致肺宣降失常而发咳嗽，外邪夹痰饮伏留肺络，津液无法上乘则咽痒干咳。《伤寒论》第四十条云:“伤寒表不解，心下有水气，干呕发热而咳，或渴，或利，或噎，或小便不利、少腹满，或喘者，小青龙汤主之”。张老师灵活运用小青龙汤化裁治疗，标本兼顾，收效甚捷。方中炙麻黄与桂枝相须相使，发散风寒与化气利水表里双解;干姜、细辛、姜半夏温化寒饮，并助麻黄、桂枝散表邪;五味子敛肺止咳、炒白芍益阴敛营，二药相合以防辛温药发散太过;炒白芍与桂枝炙甘草配伍取桂枝汤外发汗解表，内调和营卫之意;前胡、白前、桔梗、紫菀、款冬花、生姜共奏温肺下气，止咳化痰之功，寒凉之性的前胡既风散邪，又兼反佐，以防药物格拒的作用;肺与大肠互为表里，当归通过养血润肠通便以降逆肺气;二诊重用生黄芪、淫羊藿益气固表，固本培元。本案体现了张老师临证攻守取舍有方，培补正气与患者身体素质常有机结合。该患者虽呈现一派阳气不足之象，但正气尚能耐攻。如此时加入过多的益气扶正药，恐会有助邪发展之嫌。故而一诊以祛邪为主，少辅扶正之品，待二诊邪气之势基本已去再加大健脾益肾之力度。
KS7702,ty20190314050524,，男 ，18岁 ,周仲瑛,,麻黄3g，杏仁10g，生石膏30g，炙甘草10g，茯苓30g，干姜10g，五味子10g，细辛3g，陈皮10g，枳实10g，厚朴20g，罂粟壳3g，桂枝15g，白芍15g，生姜10g，,,1,间断性咳嗽、胸闷4年，再发并加重1周。病人4年前因感冒后引起咳嗽、吐痰、胸闷，寒冷天气加重，服用感冒清、克咳敏、复方甘草片可减轻，但缠绵难愈，每到冬天即反复发作，多次中西药治疗效果欠佳。1周前，因感寒再次出现咳嗽、吐痰量多黏稠色白，夜间加重，咳甚则胸腹疼痛，胸闷，气短，纳差乏力，口干烦躁。静脉点滴青霉素3d无明显效果，多种止咳药服之无效。舌淡稍黯，苔薄白根部稍厚，脉浮紧。拟方：麻黄3g，杏仁10g，生石膏30g，炙甘草10g，茯苓30g，干姜10g，五味子10g，细辛3g，陈皮10g，枳实10g，厚朴20g，罂粟壳3g，桂枝15g，白芍15g，生姜10g，大枣3个,舌淡稍黯,苔薄白根部稍厚,脉浮紧,1998年11月，杜某，男，18岁。主诉：间断性咳嗽、胸闷4年，再发并加重1周。病人4年前因感冒后引起咳嗽、吐痰、胸闷，寒冷天气加重，服用感冒清、克咳敏、复方甘草片可减轻，但缠绵难愈，每到冬天即反复发作，多次中西药治疗效果欠佳。1周前，因感寒再次出现咳嗽、吐痰量多黏稠色白，夜间加重，咳甚则胸腹疼痛，胸闷，气短，纳差乏力，口干烦躁。静脉点滴青霉素3d无明显效果，多种止咳药服之无效。舌淡稍黯，苔薄白根部稍厚，脉浮紧。拟方：麻黄3g，杏仁10g，生石膏30g，炙甘草10g，茯苓30g，干姜10g，五味子10g，细辛3g，陈皮10g，枳实10g，厚朴20g，罂粟壳3g，桂枝15g，白芍15g，生姜10g，大枣3个。,1998年11月，杜某，男，18岁。主诉：间断性咳嗽、胸闷4年，再发并加重1周。病人4年前因感冒后引起咳嗽、吐痰、胸闷，寒冷天气加重，服用感冒清、克咳敏、复方甘草片可减轻，但缠绵难愈，每到冬天即反复发作，多次中西药治疗效果欠佳。1周前，因感寒再次出现咳嗽、吐痰量多黏稠色白，夜间加重，咳甚则胸腹疼痛，胸闷，气短，纳差乏力，口干烦躁。静脉点滴青霉素3d无明显效果，多种止咳药服之无效。舌淡稍黯，苔薄白根部稍厚，脉浮紧。拟方：麻黄3g，杏仁10g，生石膏30g，炙甘草10g，茯苓30g，干姜10g，五味子10g，细辛3g，陈皮10g，枳实10g，厚朴20g，罂粟壳3g，桂枝15g，白芍15g，生姜10g，大枣3个。
KS7703,ty20190314090502,,,,水炙桑叶皮各9g，抱茯神9g，鲜竹茹9g，光杏仁9g，江枳壳9g，冬瓜子9g，川象贝母各9g，广郁金9g，炒瓜蒌皮9g，干芦根9g,,1,,,,,患者，咳嗽略减，胁痛未除，风燥之邪挟痰热留恋，清肃失司，再拟祛风清燥而化痰热。方用：水炙桑叶皮各9g，抱茯神9g，鲜竹茹9g，光杏仁9g，江枳壳9g，冬瓜子9g，川象贝母各9g，广郁金9g，炒瓜蒌皮9g，干芦根9g。,患者，咳嗽略减，胁痛未除，风燥之邪挟痰热留恋，清肃失司，再拟祛风清燥而化痰热。方用：水炙桑叶皮各9g，抱茯神9g，鲜竹茹9g，光杏仁9g，江枳壳9g，冬瓜子9g，川象贝母各9g，广郁金9g，炒瓜蒌皮9g，干芦根9g。（摘自童少伯《随笔录》）按：本例患者外感风燥之邪，加之素有肝火，木火刑金，故肺失清润，宣降失常，发为咳嗽，属新病邪实之证。童老以祛邪为第一要务，投以桑叶、桑白皮、象贝母、干芦根祛风清热、生津救燥，加之杏仁、枳壳、瓜蒌皮通利肺气以止咳，竹茹、川贝母、冬瓜子润燥化痰，茯神健脾化湿，复以郁金行气解郁、清泻肝火，诸药相合，则风灭热清，燥润痰消，邪得速去故咳嗽可平。
KS7704,738943,,,,,,,,,,,姜XX，男，72岁。1963年2月4日就诊。咳嗽已持续一年半，经中西医治疗乏效，痰粘难咯，口干津少，心急气急，舌红苔少，脉细。系久咳伤肺，肃降无权，当益气扶正，养阴润肺。用：党参、五味子、黄精、沙参、百部、前胡、紫苑、冬花各9克，天竹子3克，服5剂，咳嗽减少，余症好转，惟尚觉头昏，稍加减，续服5剂后，病愈。按：肺朝百脉，为脏腑之华盖。受外邪侵袭，肃降失司，痰浊阻肺而咳嗽。该患者年已古稀，气血本虚，久咳化热，不能润津。故用党参、黄精补气，沙参滋阴，百部、紫苑、冬花、前胡润肺下气，消痰止咳；天竹子止咳平喘；五味子敛肺补肾益气生津止咳。共达气血得补、阴虚得滋，咳喘平息。,姜XX，男，72岁。1963年2月4日就诊。咳嗽已持续一年半，经中西医治疗乏效，痰粘难咯，口干津少，心急气急，舌红苔少，脉细。系久咳伤肺，肃降无权，当益气扶正，养阴润肺。用：党参、五味子、黄精、沙参、百部、前胡、紫苑、冬花各9克，天竹子3克，服5剂，咳嗽减少，余症好转，惟尚觉头昏，稍加减，续服5剂后，病愈。按：肺朝百脉，为脏腑之华盖。受外邪侵袭，肃降失司，痰浊阻肺而咳嗽。该患者年已古稀，气血本虚，久咳化热，不能润津。故用党参、黄精补气，沙参滋阴，百部、紫苑、冬花、前胡润肺下气，消痰止咳；天竹子止咳平喘；五味子敛肺补肾益气生津止咳。共达气血得补、阴虚得滋，咳喘平息。
KS7705,723459,，女 ，76岁 ,,,法半夏、秦艽、党参、白术、茯苓、黄芪各10克,,1,,,舌苔薄白腻,脉细缓弱,柯××，女，76岁，家庭妇女。1980年10月15日初诊。自诉反复咳嗽伴发热一年。咯痰稀白，头晕气促，易感风寒。体温37.2°~?；38.4°C面色微黄，眼胞如卧蚕状。怕冷，额汗微出，食少神倦，大便涩，小便清利，舌苔薄白腻，脉细缓弱。x线摄片示右上肺有点索状陈旧结核病灶及肺气肿征。是脾肺气虚，表卫不固，痰饮上凌之咳嗽发热。治当补益脾肺，温化痰饮，与陈夏六君子汤合玉屏风散补脾肺固表卫，加干姜、五味利肺气，助陈夏六君子汤温化痰饮，秦艽退虚热。处方：法半夏、秦艽、党参、白术、茯苓、黄芪各10克。防风、干姜、陈皮、五味子、炙甘草各5克。服药三剂，热退、食增、咳嗽大减。,柯××，女，76岁，家庭妇女。1980年10月15日初诊。自诉反复咳嗽伴发热一年。咯痰稀白，头晕气促，易感风寒。体温37.2°~?38.4°C面色微黄，眼胞如卧蚕状。怕冷，额汗微出，食少神倦，大便涩，小便清利，舌苔薄白腻，脉细缓弱。x线摄片示右上肺有点索状陈旧结核病灶及肺气肿征。是脾肺气虚，表卫不固，痰饮上凌之咳嗽发热。治当补益脾肺，温化痰饮，与陈夏六君子汤合玉屏风散补脾肺固表卫，加干姜、五味利肺气，助陈夏六君子汤温化痰饮，秦艽退虚热。处方：法半夏、秦艽、党参、白术、茯苓、黄芪各10克。防风、干姜、陈皮、五味子、炙甘草各5克。服药三剂，热退、食增、咳嗽大减。
KS7706,146943,,,,,,,,,,,陈某，男，33岁，北京市患者，2008年10月就诊。患者诊断HIV感染5年，目前未服用西药治疗，近2年在我院门诊坚持接受中药治疗，主诉顽固性咳嗽近2年，自觉咽痒，干咳为主，偶有少量白痰，不易咯出。经西医检查除外结核，无发热、盗汗等症状。一直服用中药汤剂无明显疗效。面色白，舌淡红，略胖大，苔薄白略腻，脉沉细弦，辨证为寒饮犯肺，予小青龙汤原方。处方如下∶桂枝15g，白芍10g，生麻黄6g，干姜15g，细辛10g，炙甘草6g，五味子10g，法半夏15g，7付，每日1付，水煎服。患者服汤药3付后咳嗽即明显减轻，服完7付后咳嗽痊愈。以附子理中汤加味7付而收全功，门诊随访迄今半年余未复发。,陈某，男，33岁，北京市患者，2008年10月就诊。患者诊断HIV感染5年，目前未服用西药治疗，近2年在我院门诊坚持接受中药治疗，主诉顽固性咳嗽近2年，自觉咽痒，干咳为主，偶有少量白痰，不易咯出。经西医检查除外结核，无发热、盗汗等症状。一直服用中药汤剂无明显疗效。面色白，舌淡红，略胖大，苔薄白略腻，脉沉细弦，辨证为寒饮犯肺，予小青龙汤原方。处方如下∶桂枝15g，白芍10g，生麻黄6g，干姜15g，细辛10g，炙甘草6g，五味子10g，法半夏15g，7付，每日1付，水煎服。患者服汤药3付后咳嗽即明显减轻，服完7付后咳嗽痊愈。以附子理中汤加味7付而收全功，门诊随访迄今半年余未复发。
KS7707,ty20190314020890,，男 ，75岁 ,林琳,为肺胀,黄芪、白术、党参、葶苈子各30g，生地黄、仙茅、淫羊藿、陈皮各15g，升麻5g，柴胡、当归、桃仁、红花、赤芍、枳壳、桔梗、牛膝、法半夏、紫苏子、炙甘草各10g,,1,,,苔白，脉弦滑,脉弦滑,患者，男，75岁。既往有反复咳嗽、咯痰20余年，气促15年病史，目前病情较平时无明显加重。诊见：形体消瘦，乏力，偶有咳嗽，咯白黏痰，量不多，动辄气促，时有胸部憋闷感，无胸痛，无发热、恶寒，少许口干，无口苦，纳呆寐差，夜尿多，排便无力，舌淡暗、舌下络脉迂曲，苔白，脉弦滑。中医诊断为肺胀，证属肺脾肾虚，痰瘀内阻。处方：黄芪、白术、党参、葶苈子各30g，生地黄、仙茅、淫羊藿、陈皮各15g，升麻5g，柴胡、当归、桃仁、红花、赤芍、枳壳、桔梗、牛膝、法半夏、紫苏子、炙甘草各10g。每天1剂，水煎服。服药7剂后，患者偶有咳嗽，痰白较少，乏力感减轻，纳寐好转，排便顺畅，胸闷感减轻，平地行走耐受时间增多。,患者，男，75岁。既往有反复咳嗽、咯痰20余年，气促15年病史，目前病情较平时无明显加重。诊见：形体消瘦，乏力，偶有咳嗽，咯白黏痰，量不多，动辄气促，时有胸部憋闷感，无胸痛，无发热、恶寒，少许口干，无口苦，纳呆寐差，夜尿多，排便无力，舌淡暗、舌下络脉迂曲，苔白，脉弦滑。中医诊断为肺胀，证属肺脾肾虚，痰瘀内阻。处方：黄芪、白术、党参、葶苈子各30g，生地黄、仙茅、淫羊藿、陈皮各15g，升麻5g，柴胡、当归、桃仁、红花、赤芍、枳壳、桔梗、牛膝、法半夏、紫苏子、炙甘草各10g。每天1剂，水煎服。服药7剂后，患者偶有咳嗽，痰白较少，乏力感减轻，纳寐好转，排便顺畅，胸闷感减轻，平地行走耐受时间增多。
KS7708,840102,,,,,,,,,,,"余邻里有一汤姓幼儿,出生四月,患发热咳嗽,其父甫毕业于医学院,诊断为病毒性支气管肺炎,用多种抗生素治疗,历时月余,发热起伏而不退清,咳嗽反日益加剧。遂来余处要求中药调治。患儿发热38.1℃(肛门),形体瘦小,面色苍白,四肢不温,痰声漉漉,微有喘息,咳嗽连连,其声不扬,呕吐痰涎,舌淡苔白。此外有寒邪,内有寒饮,患儿幼小,病程久延,正气已虚,乃为处方麻黄附子细辛汤合二陈汤加生姜三片,浓煎频喂。其父睹方后似有疑虑之色。余日:病虽属炎症,但毫无热象于见,但服无妨。服二剂后咳减,三剂而咳止,热退病愈。其父始信服“炎症”亦有属于虚寒者。","余邻里有一汤姓幼儿,出生四月,患发热咳嗽,其父甫毕业于医学院,诊断为病毒性支气管肺炎,用多种抗生素治疗,历时月余,发热起伏而不退清,咳嗽反日益加剧。遂来余处要求中药调治。患儿发热38.1℃(肛门),形体瘦小,面色苍白,四肢不温,痰声漉漉,微有喘息,咳嗽连连,其声不扬,呕吐痰涎,舌淡苔白。此外有寒邪,内有寒饮,患儿幼小,病程久延,正气已虚,乃为处方麻黄附子细辛汤合二陈汤加生姜三片,浓煎频喂。其父睹方后似有疑虑之色。余日:病虽属炎症,但毫无热象于见,但服无妨。服二剂后咳减,三剂而咳止,热退病愈。其父始信服“炎症”亦有属于虚寒者。"
